sharepointid,Rank,itemid,docname,doctype,application,appno,conclusion,importance,originatingbody,typedescription,kpdate,kpdateAsText,documentcollectionid,documentcollectionid2,languageisocode,extractedappno,isplaceholder,doctypebranch,respondent,respondentOrderEng,ecli,article,applicability,decisiondate,externalsources,introductiondate,issue,judgementdate,kpthesaurus,meetingnumber,representedby,separateopinion,scl,parties,conclusion_detail,articles_detail,paragraphs
373158,922.848083496094,001-113300,CASE OF KAKABADZE AND OTHERS v. GEORGIA,HEJUD,MS WORD,1484/07,"[{'element': 'Violation of Article 5 - Right to liberty and security', 'details': ['Article 5-1 - Lawful arrest or detention'], 'type': 'violation', 'article': '5', 'base_article': '5'}, {'element': 'Violation of Article 6+6-3-c - Right to a fair trial', 'details': ['Article 6 - Criminal proceedings', 'Article 6-1 - Fair hearing'], 'mentions': ['Article 6-3-c - Defence through legal assistance', 'Article 6 - Right to a fair trial'], 'type': 'violation', 'article': '6-3-c', 'base_article': '6'}, {'element': 'Violation of Article 11 - Freedom of assembly and association', 'details': ['Article 11-1 - Freedom of peaceful assembly'], 'type': 'violation', 'article': '11', 'base_article': '11'}, {'element': 'Violation of Article 2 of Protocol No. 7 - Right of appeal in criminal matters', 'details': ['Article 2 of Protocol No. 7 - National law', 'Minor offences', 'Criminal offence'], 'type': 'violation', 'article': 'p7-2', 'base_article': 'p7-2'}, {'element': 'Non-pecuniary damage - award', 'type': 'other'}]",2,6,15,10/2/2012 12:00:00 AM,02/10/2012 00:00:00,"['CASELAW', 'JUDGMENTS', 'CHAMBER', 'ENG']",CASELAW;JUDGMENTS;CHAMBER;ENG,ENG,"['1484/07', '1704/06', '61406/00', '25491/04', '26986/03', '21272/03', '27785/95', '21519/02', '8080/08', '8577/08', '71503/01', '13229/03', '46295/99', '21906/04', '656/06', '11364/03', '28358/95', '37048/04', '42086/05', '35082/04', '19359/04', '34320/04', '59261/00', '61821/00', '37568/97', '65559/01', '20652/92', '27520/07', '27798/95', '2668/07', '6102/08', '30079/08', '7072/09', '7124/09', '6991/08', '15084/08', '74989/01', '10877/04', '43425/98', '23118/93', '28793/02', '7975/06', '35403/06', '23204/07']",False,CHAMBER,GEO,17,ECLI:CE:ECHR:2012:1002JUD000148407,"['p7-2', '5', '11', '6', '35', '41']",,,[],,"['Code of Administrative Offences', 'Section 76(3) § 1 of the Courts Act', 'Articles 208 § 6(1) and 208 § 7 of the Code of Criminal Procedure (“the CCP”)', 'Article 249 of the Code on Administrative Offences (“the CAO”)']",02/10/2012 00:00:00,448;220;445;76;136;86;145;151;202;14;216;443;548;255;251,,"['JAPARIDZE S.', 'KATSITADZE N.', 'LEACH Ph.']",FALSE,"Altug Taner Akçam v. Turkey, no. 27520/07, §§ 92-95, 25 October 2011;Amann v. Switzerland [GC], no. 27798/95, §§ 78-80, ECHR 2000-II;Assanidze v. Georgia [GC], no. 71503/01, § 170, ECHR 2004-II;Baranowski v. Poland, no. 28358/95, § 52, ECHR 2000-III;Benham v. the United Kingdom, 10 June 1996, § 47, Reports of Judgments and Decisions 1996-III;Böhmer v. Germany, no. 37568/97, §§ 54 and 56, 3 October 2002;Bozano v. France, 18 December 1986, Series A no. 111;Christian Democratic People’s Party v. Moldova, no. 28793/02, § 70, ECHR 2006-II;Dink v. Turkey, nos. 2668/07, 6102/08, 30079/08, 7072/09 and 7124/09, § 116, 14 September 2010;Djavit An v. Turkey, no. 20652/92, § 56, ECHR 2003-III;Ezelin v. France, 26 April 1991, Series A no. 202;Fey v. Austria, 24 February 1993, § 30, Series A no. 255-A;Galstyan v. Armenia, no. 26986/03, 15 November 2007;Ghavtadze v. Georgia, no. 23204/07, §§ 118 and 120, 3 March 2009;Giorgi Nikolaishvili v. Georgia, no. 37048/04, § 53, 13 January 2009;Gurepka v. Ukraine, no. 61406/00, §§ 59-61, 6 September 2005;Hakobyan and Others v. Armenia, no. 34320/04, 10 April 2012;Hyde Park and Others v. Moldova (nos. 5 and 6), nos. 6991/08 and 15084/08, 14 September 2010;Kafkaris v. Cyprus [GC], no. 21906/04, § 116, ECHR 2008;Khadisov and Tsechoyev v. Russia, no. 21519/02, § 151, 5 February 2009;Klaus and Yuri Kiladze v. Georgia, no. 7975/06, §§ 91-94, 2 February 2010;Liu v. Russia, no. 42086/05, § 82, 6 December 2007;M. v. Germany, no. 19359/04, ECHR 2009;Makhmudov v. Russia, no. 35082/04, § 80 and 81, 26 July 2007;Menesheva v. Russia, no. 59261/00, ECHR 2006-III;Mooren v. Germany [GC], no. 11364/03, § 76, 9 July 2009;Nasrulloyev v. Russia, no. 656/06, § 71, 11 October 2007;Nešták v. Slovakia, no. 65559/01, §§ 88 and 89, 27 February 2007;Nilsen and Johnsen v. Norway [GC], no. 23118/93, §§ 52 and 53, ECHR 1999-VIII;Ouranio Toxo and Others v. Greece, no. 74989/01, § 36, ECHR 2005-X (extracts);Saadi v. the United Kingdom [GC], no. 13229/03, 29 January 2008;Sakhnovskiy v. Russia [GC], no. 21272/03, §§ 40-45, 2 November 2010;Schwabe and M.G. v. Germany, nos. 8080/08 and 8577/08, ECHR 2011 (extracts);Sergey Kuznetsov v. Russia, no. 10877/04, 23 October 2008;Skalka v. Poland, no. 43425/98, 27 May 2003;Stafford v. the United Kingdom [GC], no. 46295/99, § 63, ECHR 2002-IV;The Foundation Mrevli v. Georgia (dec.), no. 25491/04, 5 May 2009;The Sunday Times v. the United Kingdom (no. 1), 26 April 1979, §§ 63 and 64, Series A no. 30;Tsintsabadze v. Georgia, no. 35403/06, § 105, 15 February 2011;Wloch v. Poland, no. 27785/95, § 90, ECHR 2000-XI;Ziliberberg v. Moldova, no. 61821/00, §§ 40-42, 1 February 2005","['KAKABADZE AND OTHERS', 'GEORGIA']",Remainder inadmissible;Violation of Article 5 - Right to liberty and security (Article 5-1 - Lawful arrest or detention);Violation of Article 6+6-3-c - Right to a fair trial (Article 6 - Criminal proceedings;Article 6-1 - Fair hearing) (Article 6-3-c - Defence through legal assistance;Article 6 - Right to a fair trial);Violation of Article 11 - Freedom of assembly and association (Article 11-1 - Freedom of peaceful assembly);Violation of Article 2 of Protocol No. 7 - Right of appeal in criminal matters (Article 2 of Protocol No. 7 - National law;Minor offences;Criminal offence);Non-pecuniary damage - award,5;5-1;6;6+6-3-c;6-1;6-3-c;11;11-1;11-2;35;41;P7-2,"['P7-2', '5', '11', '5-1', '41', '6', '11-2', '6-3-c', '11-1', '35', '6-1']"
414778,658.197875976563,001-90535,CASE OF SAPEYAN v. ARMENIA,HEJUD,MS WORD,35738/03,"[{'element': 'Preliminary objection dismissed', 'details': ['Article 35-1 - Six month period'], 'type': 'other'}, {'element': 'Violation of Article 11 - Freedom of assembly and association', 'details': ['Article 11-1 - Freedom of peaceful assembly'], 'type': 'violation', 'article': '11', 'base_article': '11'}, {'element': 'Non-pecuniary damage - award', 'details': ['Article 41 - Non-pecuniary damage', 'Just satisfaction'], 'type': 'other'}]",3,6,15,1/13/2009 12:00:00 AM,13/01/2009 00:00:00,"['CASELAW', 'JUDGMENTS', 'CHAMBER', 'ENG']",CASELAW;JUDGMENTS;CHAMBER;ENG,ENG,"['35738/03', '26986/03', '6562/03', '56796/00', '56581/00', '57420/00', '21287/02', '31697/03', '48662/99', '35833/97', '23949/94', '42576/98', '39977/98', '29703/05', '56679/00', '64359/01', '48907/99', '53203/99', '33202/96']",False,CHAMBER,ARM,3,ECLI:CE:ECHR:2009:0113JUD003573803,"['11', '35', '41']",,,[],,"['Article 180.1 of the Code of Administrative Offences (Վարչական իրավախախտումների վերաբերյալ ՀՀ օրենսգիրք – “the CAO”)', 'USSR Law on Approving Decrees of the Chairmanship of the Supreme Soviet of the USSR on Making Amendments and Supplements to Certain USSR Legal Acts of 28 October 1988', '']",13/01/2009 00:00:00,145;151;317;14;471;216;577;283,,"['YILDIZ K.', 'STOCK A.', 'CLARIDGE L.', 'TER-YESAYAN T.', 'ZOHRABYAN A.', 'GHAZARYAN A.']",FALSE,"Galstyan v. Armenia,no. 26986/03, § 26, 15 November 2007;
Mkrtchyan v. Armenia, no. 6562/03, §§ 20-28, 11 January 2007
","['SAPEYAN', 'ARMENIA']",Preliminary objection dismissed (Article 35-1 - Six month period);Remainder inadmissible;Violation of Article 11 - Freedom of assembly and association (Article 11-1 - Freedom of peaceful assembly);Non-pecuniary damage - award (Article 41 - Non-pecuniary damage;Just satisfaction),11;11-1;11-2;35;35-1;41,"['11', '11-2', '35-1', '11-1', '35', '41']"
348590,657.197875976563,001-90537,CASE OF GASPARYAN v. ARMENIA (No. 1),HEJUD,MS WORD,35944/03,"[{'element': 'Violation of Article 11 - Freedom of assembly and association', 'type': 'violation', 'article': '11', 'base_article': '11'}]",4,6,15,1/13/2009 12:00:00 AM,13/01/2009 00:00:00,"['CASELAW', 'JUDGMENTS', 'CHAMBER', 'ENG']",CASELAW;JUDGMENTS;CHAMBER;ENG,ENG,"['35944/03', '26986/03', '56796/00', '56581/00', '57420/00', '21287/02', '31697/03', '48662/99', '35833/97', '23949/94', '42576/98', '39977/98', '29703/05', '56679/00', '37415/97', '33268/03', '6562/03', '53203/99', '33202/96']",False,CHAMBER,ARM,3,ECLI:CE:ECHR:2009:0113JUD003594403,['11'],,,[],,[],13/01/2009 00:00:00,145,,"['MULLER M.', 'OTTY T.', 'YILDIZ K.', 'STOCK A.', 'CLARIDGE L.', 'TER-YESAYAN T.', 'ZOHRABYAN A.', 'GHAZARYAN A.']",FALSE,,"['GASPARYAN', 'ARMENIA']",Violation of Article 11 - Freedom of assembly and association,11,['11']
348640,657.197875976563,001-90600,CASE OF AMIRYAN v. ARMENIA,HEJUD,MS WORD,31553/03,"[{'element': 'Violation of Article 11 - Freedom of assembly and association', 'type': 'violation', 'article': '11', 'base_article': '11'}]",4,6,15,1/13/2009 12:00:00 AM,13/01/2009 00:00:00,"['CASELAW', 'JUDGMENTS', 'CHAMBER', 'ENG']",CASELAW;JUDGMENTS;CHAMBER;ENG,ENG,"['31553/03', '26986/03', '6562/03', '56796/00', '56581/00', '57420/00', '21287/02', '31697/03', '48662/99', '35833/97', '23949/94', '42576/98', '39977/98', '29703/05', '56679/00', '53203/99', '33202/96']",False,CHAMBER,ARM,3,ECLI:CE:ECHR:2009:0113JUD003155303,['11'],,,[],,[],13/01/2009 00:00:00,145,,"['YILDIZ K.', 'STOCK A.', 'CLARIDGE L.', 'TER-YESAYAN T.', 'ZOHRABYAN A.', 'GHAZARYAN A.']",FALSE,,"['AMIRYAN', 'ARMENIA']",Violation of Article 11 - Freedom of assembly and association,11,['11']
356196,727.941345214844,001-98363,CASE OF BREGA v. MOLDOVA,HEJUD,MS WORD,52100/08,"[{'element': 'Violation of Art. 3', 'type': 'violation', 'article': '3', 'base_article': '3'}, {'element': 'Violation of Art. 5-1', 'type': 'violation', 'article': '5-1', 'base_article': '5'}, {'element': 'Violation of Art. 11', 'type': 'violation', 'article': '11', 'base_article': '11'}]",4,7,15,4/20/2010 12:00:00 AM,20/04/2010 00:00:00,"['CASELAW', 'JUDGMENTS', 'CHAMBER', 'ENG']",CASELAW;JUDGMENTS;CHAMBER;ENG,ENG,"['52100/08', '38361/97', '5140/02', '18491/07', '30210/96', '28524/95', '23118/93', '31107/96']",False,CHAMBER,MDA,29,ECLI:CE:ECHR:2010:0420JUD005210008,"['11', '3', '5']",,,[],,[],20/04/2010 00:00:00,350;448;145,,"['JEREGHI V.', 'BAYRAM N.']",FALSE,,"['BREGA', 'MOLDOVA']",Violation of Art. 3;Violation of Art. 5-1;Violation of Art. 11,3;5;5-1;11,"['11', '5-1', '3', '5']"
482871,2822.22631835938,001-187732,CASE OF OGNEVENKO v. RUSSIA,HEJUD,MS WORD,44873/09,"[{'element': 'Remainder inadmissible', 'details': ['Art. 35'], 'type': 'other'}, {'element': 'Admissibility criteria', 'details': ['Art. 35-3-a'], 'type': 'other'}, {'element': 'Violation of Article 11 - Freedom of assembly and association', 'details': ['Article 11-1 - Freedom of association'], 'type': 'violation', 'article': '11', 'base_article': '11'}, {'element': 'Pecuniary and non-pecuniary damage - award', 'details': ['Article 41 - Non-pecuniary damage', 'Pecuniary damage', 'Just satisfaction'], 'type': 'other'}]",3,6,15,11/20/2018 12:00:00 AM,20/11/2018 00:00:00,"['CASELAW', 'JUDGMENTS', 'CHAMBER', 'ENG']",CASELAW;JUDGMENTS;CHAMBER;ENG,ENG,"['44873/09', '6615/03', '68959/01', '30668/96', '74025/01', '34503/97', '38190/97', '28602/95', '53574/99', '31045/10', '2330/09', '32191/09', '10609/10', '39748/98', '10877/04', '4241/03', '48408/12', '22723/93', '22724/93', '22725/93', '48876/08', '67667/09', '74611/01', '23018/04', '40378/06', '29411/07', '44092/12', '56717/12', '42911/08', '15557/10', '28859/11', '28473/12', '65731/01', '65900/01', '23800/06']",False,CHAMBER,RUS,38,ECLI:CE:ECHR:2018:1120JUD004487309,"['11', '35', '41']",,,"['Digest of decisions and principles (fifth (revised) edition, 2006) of the ILO Committee of Freedom of Association in the Section entitled “Right to strike”', 'Articles 6, G and Appendix Article 6, paragraph 4 of the European Social Charter (revised version of 1995)', 'PACE Resolution 2033 (2015) “Protection of the right to bargain collectively, including the right to strike”, adopted on 28 January 2015', 'PACE Resolution 2146 (2017) on “Reinforcing social dialogue as an instrument for stability and decreasing social and economic inequalities”, adopted on 25 January 2017', 'European Committee of Social Rights’s Digest of the case-law of 1 September 2008', 'Conclusions on the situation in Russia as regards collective action (2014/def/RUS) of the European Committee of Social Rights']",,"['Article 26 § 2 of the 2003 Railway Act', 'Article 17 of the 1995 Railway Act']",20/11/2018 00:00:00,145;141;146;14;236;216;577;283;305;354,,['Centre for Social and Labour Rights'],TRUE,"Adefdromil v. France, no. 32191/09, § 55, 2 October 2014;Animal Defenders International v. the United Kingdom [GC], no. 48876/08, § 108, ECHR 2013 (extracts);Bayev and Others v. Russia, nos. 67667/09 and 2 others, § 63, 20 June 2017;Demir and Baykara v. Turkey [GC], no. 34503/97, ECHR 2008;Dilek and Others v. Turkey, nos. 74611/01 and 2 others, § 72, 17 July 2007;Enerji Yapı-Yol Sen v. Turkey, no. 68959/01, § 32, 21 April 2009;Ezelin v. France, 26 April 1991, Series A no. 202;Karaçay v. Turkey, no. 6615/03, § 36, 27 March 2007;Maestri v. Italy [GC], no. 39748/98, § 26, ECHR 2004 I;Matelly v. France, no. 10609/10, § 71, 2 October 2014;National Union of Belgian Police v. Belgium, 27 October 1975, §§ 39-40, Series A no. 19;National Union of Rail, Maritime and Transport Workers v. the United Kingdom, no. 31045/10, § 84, ECHR 2014;Schmidt and Dahlström v. Sweden, 6 February 1976, § 36, Series A no. 21;Sergey Kuznetsov v. Russia, no. 10877/04, § 35, 23 October 2008;Sidiropoulos and Others v. Greece, 10 July 1998, § 40, Reports 1998 IV;Sindicatul “Păstorul cel Bun” v. Romania [GC], no. 2330/09, § 145, ECHR 2013 (extracts);Swedish Engine Drivers’ Union v. Sweden, judgment of 6 February 1976, §§ 39-41, Series A no. 20;Trofimchuk v. Ukraine, no. 4241/03, § 35, 28 October 2010;Tüm Haber Sen and Çınar v. Turkey, no. 28602/95, ECHR 2006 II;UNISON v. the United Kingdom (dec.), no. 53574/99, ECHR 2002 I;Urcan and Others v. Turkey, nos. 23018/04 and 10 others, § 34, 17 July 2008;Veniamin Tymoshenko and Others v. Ukraine, no. 48408/12, § 84, 2 October 2014;Wilson, National Union of Journalists and Others v. the United Kingdom, nos. 30668/96 and 2 others, ECHR 2002 V;Y.Y. v. Russia, no. 40378/06, § 70, 23 February 2016;Yazar and Others v. Turkey, nos. 22723/93, 22724/93 and 22725/93, § 51, ECHR 2002 II","['OGNEVENKO', 'RUSSIA']",Remainder inadmissible (Art. 35) Admissibility criteria;(Art. 35-3-a) Manifestly ill-founded;Violation of Article 11 - Freedom of assembly and association (Article 11-1 - Freedom of association);Pecuniary and non-pecuniary damage - award (Article 41 - Non-pecuniary damage;Pecuniary damage;Just satisfaction),11;11-1;35;35-3-a;41,"['11', '35-3-a', '11-1', '35', '41']"
421343,544.406005859375,001-73291,CASE OF TSONEV v. BULGARIA,HEJUD,MS WORD,45963/99,"[{'element': 'Violation of Art. 11', 'type': 'violation', 'article': '11', 'base_article': '11'}, {'element': 'Not necessary to examine under Art. 6-1', 'type': 'other'}, {'element': 'Pecuniary damage - claim dismissed', 'type': 'other'}, {'element': 'Non-pecuniary damage - finding of violation sufficient', 'type': 'other'}, {'element': 'Costs and expenses - claim dismissed', 'type': 'other'}]",3,4,15,4/13/2006 12:00:00 AM,13/04/2006 00:00:00,"['CASELAW', 'JUDGMENTS', 'CHAMBER', 'ENG']",CASELAW;JUDGMENTS;CHAMBER;ENG,ENG,"['45963/99', '44158/98', '46626/99', '45701/99', '29221/95', '29225/95', '22723/93', '22724/93', '22725/93', '41340/98', '41342/98', '41343/98', '41344/98', '23885/94', '27608/95']",False,CHAMBER,BGR,8,ECLI:CE:ECHR:2006:0413JUD004596399,"['11', '6', '41']",,,[],,"['Article 44 of the Constitution 1991', 'Political Parties Act 1990, sections 3(2), 7, 8(1) and 9']",13/04/2006 00:00:00,145;146;266;260;375;445;40;136;216,,['VASILEV I.'],TRUE,"Freedom and Democracy Party (ÖZDEP) v. Turkey [GC], no. 23885/94, § 44, ECHR 1999 VIII;Gorzelik and Others v. Poland [GC], no. 44158/98, §§ 52, 91, 101, 105, ECHR 2004 I;Metropolitan Church of Bessarabia and Others v. Moldova, no. 45701/99, §§ 107 10, ECHR 2001 XII;Partidul Comunistilor (Nepeceristi) and Ungureanu v. Romania, no. 46626/99, §§ 27, 34, 44, 49, 55, 56, 57, 70, 3 February 2005;Refah Partisi (The Welfare Party) and Others v. Turkey [GC], nos. 41340/98, 41342/98, 41343/98 and 41344/98, §§ 98, 101, ECHR 2003 II;Sidiropoulos and Others v. Greece, judgment of 10 July 1998, Reports 1998 IV, §§ 31, 38, 40, 46, 50;Socialist Party and Others v. Turkey, judgment of 25 May 1998, Reports 1998 III, §§ 60, 67;Stankov and the United Macedonian Organisation Ilinden v. Bulgaria, nos. 29221/95 and 29225/95, §§ 81, 82, 85, ECHR 2001 IX;United Communist Party of Turkey and Others v. Turkey, judgment of 30 January 1998, Reports 1998 I, §§ 25, 36, 42, 43, 46, 47, 54, 69, 73;Yazar and Others v. Turkey, nos. 22723/93, 22724/93 and 22725/93, § 49, ECHR 2002 II","['TSONEV', 'BULGARIA']",Violation of Art. 11;Not necessary to examine under Art. 6-1;Pecuniary damage - claim dismissed;Non-pecuniary damage - finding of violation sufficient;Costs and expenses - claim dismissed,6;6-1;11;11-1;11-2;41,"['11', '41', '6', '11-2', '11-1', '6-1']"
451703,600.4794921875,001-82825,CASE OF NASIBOVA v. AZERBAIJAN,HEJUD,MS WORD,4307/04,"[{'element': 'Violation of Art. 11', 'type': 'violation', 'article': '11', 'base_article': '11'}]",4,4,15,10/18/2007 12:00:00 AM,18/10/2007 00:00:00,"['CASELAW', 'JUDGMENTS', 'CHAMBER', 'ENG']",CASELAW;JUDGMENTS;CHAMBER;ENG,ENG,"['4307/04', '40368/02', '44363/02', '25088/94', '28331/95', '28443/95', '138/03']",False,CHAMBER,AZE,5,ECLI:CE:ECHR:2007:1018JUD000430704,['11'],,,[],,[],18/10/2007 00:00:00,145,,"['ALIYEV I.', 'GULIYEVA G.']",FALSE,,"['NASIBOVA', 'AZERBAIJAN']",Violation of Art. 11,11,['11']
340085,569.299499511719,001-78330,CASE OF OYA ATAMAN v. TURKEY,HEJUD,MS WORD,74552/01,"[{'element': 'Violation of Art. 11', 'type': 'violation', 'article': '11', 'base_article': '11'}, {'element': 'Pecuniary damage - claim dismissed', 'type': 'other'}, {'element': 'Non-pecuniary damage - finding of violation sufficient', 'type': 'other'}, {'element': 'Costs and expenses partial award - Convention proceedings', 'type': 'other'}]",1,5,15,12/5/2006 12:00:00 AM,05/12/2006 00:00:00,"['CASELAW', 'JUDGMENTS', 'CHAMBER', 'ENG']",CASELAW;JUDGMENTS;CHAMBER;ENG,ENG,"['74552/01', '30210/96', '25803/94', '24888/94', '26772/95', '55982/00', '20652/92', '51346/99', '31195/96']",False,CHAMBER,TUR,47,ECLI:CE:ECHR:2006:1205JUD007455201,"['11', '3', '29', '41']",,,"['Opinion of the Venice Commission (2005) interpreting the OSCE/ODHIR guidelines on drafting laws on freedom of assembly with regard to the regulation of public meetings', 'Convention on the Prohibition of the Development, Production, Stockpiling and Use of Chemical Weapons and on their Destruction of 13 January 1993 (“the CWC”)']",,"['Article 34 of the Constitution, law no. 2911 on assemblies and marches, Articles 10, 22 and 24']",05/12/2006 00:00:00,145;151;266;332;375;350;193;354;216,,['SAN G.'],FALSE,"Assenov and Others v. Bulgaria, judgment of 28 October 1998, Reports of Judgments and Decisions 1998-VIII, p. 3288, § 93;Chahal v. the United Kingdom, judgment of 15 November 1996, Reports 1996-V, p. 1855, § 79;Cisse v. France, no. 51346/99, § 50, ECHR 2002-III (extracts);Djavit An v. Turkey, no. 20652/92, §§ 56-57, ECHR 2003-III;Kiliçgedik v. Turkey (dec.), no. 55982/00, 1 June 2004;Klaas v. Germany, judgment of 22 September 1993, Series A no. 269, pp. 17-18, § 30;Kudla v. Poland [GC], no. 30210/96, § 92, ECHR 2000-XI;Labita v. Italy [GC], no. 26772/95, § 120, ECHR 1999-IV;Nikolova v. Bulgaria [GC], no. 31195/96, § 79, ECHR 1999-II;Piermont v. France, judgment of 27 April 1995, Series A no. 314, §§ 76-77;Plattform « Ärzte für das Leben » v. Austria, judgment of 21 June 1988, Series A no. 139, p. 12, § 32;Raninen v. Finland, judgment of 16 December 1997, Reports 1997-VIII, pp. 2821-2822, § 55;Selmouni v. France [GC], no. 25803/94, § 95, ECHR 1999-V;V. v. the United Kingdom [GC], no. 24888/94, § 71, ECHR 1999-IX","['OYA ATAMAN', 'TURKEY']",Violation of Art. 11;Pecuniary damage - claim dismissed;Non-pecuniary damage - finding of violation sufficient;Costs and expenses partial award - Convention proceedings,3;29;29-3;11;11-1;11-2;41,"['29-3', '11', '3', '11-2', '11-1', '29', '41']"
341496,566.88623046875,001-78101,CASE OF DEMİR AND BAYKARA v. TURKEY,HEJUD,MS WORD,34503/97,"[{'element': 'Violation of Art. 11', 'type': 'violation', 'article': '11', 'base_article': '11'}, {'element': 'Not necessary to examine Art. 14', 'type': 'other'}, {'element': 'Pecuniary damage - financial award', 'type': 'other'}, {'element': 'Non-pecuniary damage - financial award', 'type': 'other'}]",2,5,15,11/21/2006 12:00:00 AM,21/11/2006 00:00:00,"['CASELAW', 'JUDGMENTS', 'CHAMBER', 'ENG']",CASELAW;JUDGMENTS;CHAMBER;ENG,ENG,"['34503/97', '28602/95', '30668/96', '30671/96', '30678/96', '29529/95', '53507/99']",False,CHAMBER,TUR,47,ECLI:CE:ECHR:2006:1121JUD003450397,"['11', '14', '41']",,,"['Article 2 of the Convention No. 87 of the International Labour Organisation', 'Articles 4, 5 and 6 of the Convention No. 98 of the International Labour Organisation', 'Articles 5 et 6 of the European Social Charter (revised)']",,"['Constitution, Articles 51, 53 and 128', 'Law no. 4121 of 23 July 1995', 'Law no. 4709 of 3 October 2001', 'Article 5 of Legislative-Decree no. 2 of 23 December 1972']",21/11/2006 00:00:00,145;146;202;246;266;332;317;343;100;216,,['KIZILOZ AYHAN'],TRUE,"Gustafsson v. Sweden, judgment of 25 April 1996, Reports of Judgments and Decisions 1996-II, pp. 652-653, § 45;Schmidt and Dahlström v. Sweden, judgment of 6 February 1976, Series A no. 21, § 34, § 36;National Union of Belgian Police v. Belgium, judgment of 27 October 1975, Series A no. 19, § 39;Swedish Engine Drivers' Union v. Sweden, judgment of 6 February 1976, Series A no. 20, § 39, § 40;Tüm Haber Sen and Ç?nar v. Turkey, no. 28602/95, §§ 36-39, ECHR 2006-...;Wilson & the National Union of Journalists and Others v. the United Kingdom, nos. 30668/96, 30671/96 and 30678/96, § 41, § 44, ECHR 2002-V","['DEMİR AND BAYKARA', 'TURKEY']",Violation of Art. 11;Not necessary to examine Art. 14;Pecuniary damage - financial award;Non-pecuniary damage - financial award,11;11-1;11-2;14;41,"['11', '14', '11-2', '11-1', '41']"
476653,2511.00927734375,001-184495,CASE OF BAKIR AND OTHERS v. TURKEY,HEJUD,MS WORD,46713/10,"[{'element': 'Violation of Article 11 - Freedom of assembly and association', 'details': ['Article 11-1 - Freedom of peaceful assembly'], 'type': 'violation', 'article': '11', 'base_article': '11'}]",4,5,15,7/10/2018 12:00:00 AM,10/07/2018 00:00:00,"['CASELAW', 'JUDGMENTS', 'CHAMBER', 'ENG']",CASELAW;JUDGMENTS;CHAMBER;ENG,ENG,"['46713/10', '2006/10', '2007/80', '68514/01', '4870/02', '14495/11', '14531/11', '26274/11', '78923/11', '8408/12', '11848/12', '12078/12', '12103/12', '14745/12', '21910/12', '41087/12', '8077/08', '26986/03', '21613/07', '36443/06', '17526/10', '51962/12', '29994/02', '43395/09', '17224/11', '931/13', '39288/98', '3111/10', '28255/07', '44774/98', '38433/09', '14946/08', '41226/09', '30985/96', '39748/98', '30562/04', '30566/04', '38224/03', '31706/10', '33088/10', '67360/11', '37273/10', '51988/07', '16853/05', '13304/03', '33347/04', '43807/07', '23168/94', '47848/08']",False,CHAMBER,TUR,47,ECLI:CE:ECHR:2018:0710JUD004671310,['11'],,,[],,[],10/07/2018 00:00:00,145;151,,['AYTAC SALA R.'],FALSE,,"['BAKIR AND OTHERS', 'TURKEY']",Violation of Article 11 - Freedom of assembly and association (Article 11-1 - Freedom of peaceful assembly),11;11-1,"['11', '11-1']"
476654,2511.00927734375,001-184499,CASE OF İMRET v. TURKEY (No. 2),HEJUD,MS WORD,57316/10,"[{'element': 'Violation of Article 11 - Freedom of assembly and association', 'details': ['Article 11-1 - Freedom of peaceful assembly'], 'type': 'violation', 'article': '11', 'base_article': '11'}]",4,5,15,7/10/2018 12:00:00 AM,10/07/2018 00:00:00,"['CASELAW', 'JUDGMENTS', 'CHAMBER', 'ENG']",CASELAW;JUDGMENTS;CHAMBER;ENG,ENG,"['57316/10', '2006/10', '2007/80', '68514/01', '4870/02', '26986/03', '21613/07', '36443/06', '17526/10', '16637/07', '16853/05', '50841/99', '6562/03', '33268/03', '10877/04', '21831/03', '4524/06', '43395/09', '17224/11', '931/13', '39288/98', '3111/10', '28255/07', '44774/98', '38433/09', '14946/08', '41226/09', '30985/96', '39748/98', '30562/04', '30566/04', '38224/03', '31706/10', '33088/10', '29994/02', '67360/11', '37273/10', '51988/07', '47848/08']",False,CHAMBER,TUR,47,ECLI:CE:ECHR:2018:0710JUD005731610,['11'],,,[],,[],10/07/2018 00:00:00,145;151,,"['SENSES E.', 'IMRET T.']",FALSE,,"['İMRET', 'TURKEY']",Violation of Article 11 - Freedom of assembly and association (Article 11-1 - Freedom of peaceful assembly),11;11-1,"['11', '11-1']"
