sharepointid,Rank,itemid,docname,doctype,application,appno,conclusion,importance,originatingbody,typedescription,kpdate,kpdateAsText,documentcollectionid,documentcollectionid2,languageisocode,extractedappno,isplaceholder,doctypebranch,respondent,respondentOrderEng,ecli,article,applicability,decisiondate,externalsources,introductiondate,issue,judgementdate,kpthesaurus,meetingnumber,representedby,separateopinion,scl,parties,conclusion_detail,articles_detail,paragraphs
362464,771.637573242188,001-102256,CASE OF HADEP AND DEMİR v. TURKEY,HEJUD,MS WORD,28003/03,"[{'element': 'Remainder inadmissible', 'type': 'other'}, {'element': 'Violation of Art. 11', 'type': 'violation', 'article': '11', 'base_article': '11'}, {'element': 'Pecuniary damage - claim dismissed', 'type': 'other'}, {'element': 'Non-pecuniary damage - award', 'type': 'other'}]",3,5,15,12/14/2010 12:00:00 AM,14/12/2010 00:00:00,"['CASELAW', 'JUDGMENTS', 'CHAMBER', 'ENG']",CASELAW;JUDGMENTS;CHAMBER;ENG,ENG,"['28003/03', '51292/99', '65899/01', '47297/99', '41618/98', '64684/01', '34688/97', '34740/03', '4517/04', '4527/04', '4985/04', '4999/04', '5115/04', '5333/04', '5340/04', '5343/04', '6434/04', '10467/04', '43956/04', '41340/98', '41342/98', '41343/98', '41344/98', '22723/93', '22724/93', '22725/93', '23885/94', '5141/94', '26482/95', '39210/98', '39974/98', '39434/98', '51290/99', '53047/99', '52709/99', '26680/95', '38406/97', '40987/98', '25803/04', '25817/04']",False,CHAMBER,TUR,47,ECLI:CE:ECHR:2010:1214JUD002800303,"['11', '41']",,,['esolution 1308 (2002) of the Parliamentary Assembly of the Council of Europe on “Restrictions on political parties in the Council of Europe member states”'],,['Articles 68 § 4 and 69 § 7 of the Constitution'],14/12/2010 00:00:00,145;146;202;266;216,,['AYDINKAYA F.'],FALSE,"Albayrak v. Turkey, no. 38406/97, § 47, ECHR 2008-...;Birdal v. Turkey, no. 53047/99, §§ 6 and 37, 2 October 2007;Democracy and Change Party and Others v. Turkey, nos. 39210/98 and 39974/98, 26 April 2005;Demokratik Kitle Partisi and Elçi v. Turkey, no. 51290/99, 3 May 2007;Dicle for the Democratic Party (DEP) v. Turkey, no. 5141/94, 10 December 2002;Emek Partisi and Senol v. Turkey, no. 39434/98, 31 May 2005;Freedom and Democracy Party (ÖZDEP) v. Turkey, no. 23885/94, ECHR 1999-VIII;Herri Batasuna and Batasuna v. Spain, nos. 25803/04 and 25817/04, §§ 85-91, ECHR 2009-...;Korkmaz v. Turkey (no. 1), no. 40987/98, §§ 10, 26 and 28, 20 December 2005;Refah Partisi (the Welfare Party) and Others v. Turkey [GC], nos. 41340/98, 41342/98, 41343/98 and 41344/98, ECHR 2003-II;Sener v. Turkey, no. 26680/95, §§ 44-45, 18 July 2000;Socialist Party and Others v. Turkey, 25 May 1998, §§ 46-47, Reports 1998-III;Socialist Party of Turkey (STP) and Others v. Turkey, no. 26482/95, 12 November 2003;The United Communist Party of Turkey and Others v. Turkey, 30 January 1998, Reports of Judgments and Decisions 1998-I;The Welfare Party and Others v. Turkey (dec.), nos. 41340/98, 41342/98, 41343/98, 41344/98, 3 October 2000;Ulusoy v. Turkey, no. 52709/99, §§ 13, 16 and 47, 31 July 2007;Yazar and Others (HEP) v. Turkey, nos. 22723/93, 22724/93 and 22725/93, § 50, ECHR 2002-II","['HADEP AND DEMİR', 'TURKEY']",Remainder inadmissible;Violation of Art. 11;Pecuniary damage - claim dismissed;Non-pecuniary damage - award,11;11-1;11-2;41,"['11', '11-1', '11-2', '41']"
497148,5198.45703125,001-201859,CASE OF CONSERVATIVE PARTY OF RUSSIA AND OTHERS v. RUSSIA,HEJUD,MS WORD,7602/06,"[{'element': 'Violation of Article 11 - Freedom of assembly and association', 'details': ['Article 11-1 - Freedom of association'], 'type': 'violation', 'article': '11', 'base_article': '11'}]",4,27,15,3/24/2020 12:00:00 AM,24/03/2020 00:00:00,"['CASELAW', 'JUDGMENTS', 'COMMITTEE', 'ENG']",CASELAW;JUDGMENTS;COMMITTEE;ENG,ENG,"['7602/06', '37685/10', '22768/12', '46626/99', '25803/04', '25817/04', '12976/07', '41340/98', '3840/10']",False,COMMITTEE,RUS,38,ECLI:CE:ECHR:2020:0324JUD000760206,['11'],,,[],,[],24/03/2020 00:00:00,145;146,,"['KOROLYOVA N.', 'SHUMSKOY V.']",FALSE,,"['CONSERVATIVE PARTY OF RUSSIA AND OTHERS', 'RUSSIA']",Violation of Article 11 - Freedom of assembly and association (Article 11-1 - Freedom of association),11;11-1,"['11', '11-1']"
421376,536.619323730469,001-72093,CASE OF THE UNITED MACEDONIAN ORGANISATION ILINDEN AND OTHERS v. BULGARIA,HEJUD,MS WORD,59491/00,"[{'element': 'Violation of Art. 11', 'type': 'violation', 'article': '11', 'base_article': '11'}, {'element': 'Not necessary to examine Arts. 6-1 and 14', 'type': 'other'}, {'element': 'Costs and expenses partial award - domestic and Convention proceedings', 'type': 'other'}]",3,4,15,1/19/2006 12:00:00 AM,19/01/2006 00:00:00,"['CASELAW', 'JUDGMENTS', 'CHAMBER', 'ENG']",CASELAW;JUDGMENTS;CHAMBER;ENG,ENG,"['59491/00', '29221/95', '29225/95', '44079/98', '29222/95', '29223/95', '29226/95', '34960/04', '46336/99', '59489/00', '32367/96', '44158/98', '46626/99', '45701/99', '8811/02', '8813/02', '8819/02', '23556/94', '23885/94', '22723/93', '22724/93', '22725/93', '52854/99']",False,CHAMBER,BGR,8,ECLI:CE:ECHR:2006:0119JUD005949100,"['11', '14', '6', '41']",,09/09/2004 00:00:00,[],28/03/2000 00:00:00,"['Constitution 1991', 'Persons and Family Act 1949', 'Political Parties Act 1990', 'Meetings and Marches Act 1990']",19/01/2006 00:00:00,145;151;266;445;343;216,,['N/A'],TRUE,"APEH Üldözötteinek Szövetsége and Others v. Hungary (dec.), no. 32367/96, 31 August 1999;Ceylan v. Turkey [GC], no. 23556/94, §§ 32-34, ECHR 1999-IV;Dogan and Others v. Turkey, nos. 8803-8811/02, 8813/02 and 8815-8819/02, § 149, ECHR 2004-VI (extracts);Freedom and Democracy Party (ÖZDEP) v. Turkey [GC], no. 23885/94, § 41, ECHR 1999-VIII;Gorzelik and Others v. Poland [GC], no. 44158/98, §§ 52, 91, 92, 101 and 105, ECHR 2004-I;Ivanov and Others v. Bulgaria, no. 46336/99, 24 November 2005;Metropolitan Church of Bessarabia and Others v. Moldova, no. 45701/99, §§ 107-10, ECHR 2001-XII;Partidul Comunistilor (Nepeceristi) and Ungureanu v. Romania, no. 46626/99, §§ 27, 34 and 63, 3 February 2005;Ryabykh v. Russia, no. 52854/99, §§ 67 and 68, ECHR 2003-IX;Sidiropoulos and Others v. Greece, Report 1998-IV, §§ 31, 38, 40, 46, 50 and 52;Stankov and the United Macedonian Organisation Ilinden v. Bulgaria, nos. 29221/95 and 29225/95, §§ 21, 25, 29-30, 81, 82, 85, 86, 97, 99-103, 105 and 110, ECHR 2001-IX;Stankov, Trayanov, Stoychev, the United Macedonian Organisation Ilinden, Mechkarov and Others v. Bulgaria, nos. 29221/95, 29222/95, 29223/95, 29225/95 and 29226/95, Commission decision of 21 October 1996, unreported;The United Macedonian Organisation Ilinden - PIRIN and Others v. Bulgaria, no. 59489/00, 20 October 2005, §§ 15 and 21-27;The United Macedonian Organisation Ilinden and Ivanov v. Bulgaria, no. 44079/98, §§ 12-71, 20 October 2005;Yazar and Others v. Turkey, nos. 22723/93, 22724/93 and 22725/93, §§ 57 and 58, ECHR 2002-II","['THE UNITED MACEDONIAN ORGANISATION ILINDEN AND OTHERS', 'BULGARIA']",Violation of Art. 11;Not necessary to examine Arts. 6-1 and 14;Costs and expenses partial award - domestic and Convention proceedings,6;6-1;11;11-1;11-2;14;41,"['11', '41', '6', '11-2', '14', '11-1', '6-1']"
336886,591.045532226563,001-81950,CASE OF BARANKEVICH v. RUSSIA,HEJUD,MS WORD,10519/03,"[{'element': 'Violation of Art. 11', 'type': 'violation', 'article': '11', 'base_article': '11'}]",4,4,15,7/26/2007 12:00:00 AM,26/07/2007 00:00:00,"['CASELAW', 'JUDGMENTS', 'CHAMBER', 'ENG']",CASELAW;JUDGMENTS;CHAMBER;ENG,ENG,"['10519/03', '31416/96', '25522/94', '10126/82', '20652/92', '28793/02', '38187/97', '74989/01', '30668/96', '30671/96', '30678/96', '44158/98', '45701/99', '29221/95', '29225/95', '72881/01']",False,CHAMBER,RUS,38,ECLI:CE:ECHR:2007:0726JUD001051903,['11'],,,[],,[],26/07/2007 00:00:00,145,,['SYCHEV S.'],FALSE,,"['BARANKEVICH', 'RUSSIA']",Violation of Art. 11,11,['11']
336897,591.045532226563,001-81966,CASE OF MAKHMUDOV v. RUSSIA,HEJUD,MS WORD,35082/04,"[{'element': 'Violation of Art. 5-1', 'type': 'violation', 'article': '5-1', 'base_article': '5'}, {'element': 'Violation of Art. 5-5', 'type': 'violation', 'article': '5-5', 'base_article': '5'}, {'element': 'Violation of Art. 11', 'type': 'violation', 'article': '11', 'base_article': '11'}]",4,4,15,7/26/2007 12:00:00 AM,26/07/2007 00:00:00,"['CASELAW', 'JUDGMENTS', 'CHAMBER', 'ENG']",CASELAW;JUDGMENTS;CHAMBER;ENG,ENG,"['35082/04', '51585/99', '20652/92', '8440/78', '28793/02', '74989/01', '38187/97', '55723/00', '21689/93', '25642/94', '30210/96', '8036/02', '33408/03', '5140/02', '24952/94', '17582/05', '55762/00', '55974/00']",False,CHAMBER,RUS,38,ECLI:CE:ECHR:2007:0726JUD003508204,"['11', '5']",,,[],,[],26/07/2007 00:00:00,448;45;145,,['PUZANOV I.'],FALSE,,"['MAKHMUDOV', 'RUSSIA']",Violation of Art. 5-1;Violation of Art. 5-5;Violation of Art. 11,5;5-1;5-5;11,"['5-5', '11', '5-1', '5']"
347315,715.979125976563,001-97049,CASE OF CHRISTIAN DEMOCRATIC PEOPLE'S PARTY v. MOLDOVA (No. 2),HEJUD,MS WORD,25196/04,"[{'element': 'Violation of Art. 11', 'type': 'violation', 'article': '11', 'base_article': '11'}, {'element': 'Non-pecuniary damage - award', 'type': 'other'}]",3,7,15,2/2/2010 12:00:00 AM,02/02/2010 00:00:00,"['CASELAW', 'JUDGMENTS', 'CHAMBER', 'ENG']",CASELAW;JUDGMENTS;CHAMBER;ENG,ENG,"['25196/04', '41340/98', '41342/98', '41343/98', '41344/98', '28793/02', '25088/94', '28331/95', '28443/95', '30668/96', '30671/96', '30678/96', '25594/94', '25230/02', '25203/02', '27642/02', '25234/02', '25235/02', '33482/06']",False,CHAMBER,MDA,29,ECLI:CE:ECHR:2010:0202JUD002519604,"['11', '41']",,,[],,[],02/02/2010 00:00:00,145;151;266;260;332;216,,['NAGACEVSCHI V.'],FALSE,"Artico v. Italy, judgment of 13 May 1980, § 33, Series A no. 37;Castells v. Spain, 23 April 1992, § 42, Series A no. 236;Chassagnou and Others v. France [GC], nos. 25088/94, 28331/95 and 28443/95, § 112, ECHR 1999-III;Christian Democratic People's Party v. Moldova, no. 28793/02, ECHR 2006-II;Hashman and Harrup v. the United Kingdom [GC], no. 25594/94, § 28, ECHR 1999-VIII;Hyde Park and Others v. Moldova, no. 33482/06, § 30, 31 March 2009;Jersild v. Denmark, 23 September 1994, § 31, Series A no. 298;Plattform “Ärzte für das Leben” v. Austria, judgment of 21 June 1988, Series A no. 139;Refah Partisi (the Welfare Party) and Others v. Turkey [GC], nos. 41340/98, 41342/98, 41343/98 and 41344/98, §§ 86-89, ECHR 2003-II;Rosca and Others v. Moldova, nos. 25230/02, 25203/02, 27642/02, 25234/02 and 25235/02, 27 March 2008;Socialist Party and Others v. Turkey, 25 May 1998, § 50, Reports 1998-III;Steel and Others v. the United Kingdom, 23 September 1998, § 92, Reports 1998-VII;United Communist Party of Turkey and Others v. Turkey, 30 January 1998, § 47, Reports 1998-I;Wilson, National Union of Journalists and Others v. the United Kingdom, nos. 30668/96, 30671/96 and 30678/96, § 41, ECHR 2002-V;Young, James and Webster v. the United Kingdom, 13 August 1981, § 63, Series A no. 44","[""CHRISTIAN DEMOCRATIC PEOPLE'S PARTY"", 'MOLDOVA']",Violation of Art. 11;Non-pecuniary damage - award,11;11-1;11-2;41,"['11', '11-1', '11-2', '41']"
501360,8148.5751953125,001-205132,CASE OF NAGIBIN AND OTHERS v. RUSSIA,HEJUD,MS WORD,9685/08;22572/08;37565/08;37581/08;42250/08;57374/08;10460/09;39189/09;1965/10,"[{'element': 'Violation of Article 10 - Freedom of expression-{general}', 'details': ['Article 10-1 - Freedom of expression'], 'type': 'violation', 'article': '10', 'base_article': '10'}, {'element': 'Violation of Article 11 - Freedom of assembly and association', 'details': ['Article 11-1 - Freedom of peaceful assembly'], 'type': 'violation', 'article': '11', 'base_article': '11'}, {'element': 'Violation of Article 3 - Prohibition of torture', 'details': ['Article 3 - Degrading treatment'], 'mentions': ['Substantive aspect'], 'type': 'violation', 'article': '3', 'base_article': '3'}, {'element': 'Violation of Article 5 - Right to liberty and security', 'details': ['Article 5-1 - Lawful arrest or detention'], 'type': 'violation', 'article': '5', 'base_article': '5'}, {'element': 'Violation of Article 6+6-3-d - Right to a fair trial', 'details': ['Article 6 - Administrative proceedings', 'Article 6-1 - Fair hearing'], 'mentions': ['Article 6 - Right to a fair trial', 'Article 6-3 - Rights of defence', 'Article 6-3-d - Examination of witnesses'], 'type': 'violation', 'article': '6-3-d', 'base_article': '6'}]",4,27,15,10/20/2020 12:00:00 AM,20/10/2020 00:00:00,"['CASELAW', 'JUDGMENTS', 'COMMITTEE', 'ENG']",CASELAW;JUDGMENTS;COMMITTEE;ENG,ENG,"['9685/08', '22572/08', '37565/08', '37581/08', '42250/08', '57374/08', '10460/09', '39189/09', '1965/10', '57818/09', '76204/11', '25501/07', '37553/05', '1774/11', '74568/12', '54381/08', '36673/04', '20372/11']",False,COMMITTEE,RUS,38,ECLI:CE:ECHR:2020:1020JUD000968508,"['10', '5', '11', '6', '3']",,,[],,[],20/10/2020 00:00:00,350;90;448;220;445;13;136;440;122;149;148;145;151,,['MAGOMADOV A. S.'],FALSE,,"['NAGIBIN AND OTHERS', 'RUSSIA']",Violation of Article 10 - Freedom of expression-{general} (Article 10-1 - Freedom of expression);Violation of Article 11 - Freedom of assembly and association (Article 11-1 - Freedom of peaceful assembly);Violation of Article 3 - Prohibition of torture (Article 3 - Degrading treatment) (Substantive aspect);Violation of Article 5 - Right to liberty and security (Article 5-1 - Lawful arrest or detention);Violation of Article 6+6-3-d - Right to a fair trial (Article 6 - Administrative proceedings;Article 6-1 - Fair hearing) (Article 6 - Right to a fair trial;Article 6-3 - Rights of defence;Article 6-3-d - Examination of witnesses),3;5;5-1;6;6+6-3-d;6-1;6-3;6-3-d;10;10-1;11;11-1,"['6-3', '10', '10-1', '6-3-d', '5', '11', '5-1', '6', '3', '11-1', '6-1']"
501367,8148.5751953125,001-205223,CASE OF MAYZULS AND OTHERS v. RUSSIA,HEJUD,MS WORD,74602/14;3093/15;10028/15;10147/15,"[{'element': 'Violation of Article 11 - Freedom of assembly and association', 'details': ['Article 11-1 - Freedom of peaceful assembly'], 'type': 'violation', 'article': '11', 'base_article': '11'}, {'element': 'Violation of Article 5 - Right to liberty and security', 'details': ['Article 5-1 - Lawful arrest or detention'], 'type': 'violation', 'article': '5', 'base_article': '5'}, {'element': 'Violation of Article 6 - Right to a fair trial', 'details': ['Article 6 - Administrative proceedings', 'Article 6-1 - Impartial tribunal'], 'type': 'violation', 'article': '6', 'base_article': '6'}]",4,27,15,10/20/2020 12:00:00 AM,20/10/2020 00:00:00,"['CASELAW', 'JUDGMENTS', 'COMMITTEE', 'ENG']",CASELAW;JUDGMENTS;COMMITTEE;ENG,ENG,"['74602/14', '3093/15', '29580/12', '5865/07', '37553/05', '74552/01', '33482/06', '74568/12', '76204/11', '21613/07', '54381/08', '926/08', '57818/09', '10147/15', '10028/15']",False,COMMITTEE,RUS,38,ECLI:CE:ECHR:2020:1020JUD007460214,"['11', '6', '5']",,,[],,[],20/10/2020 00:00:00,448;220;445;13;180;145;151,,"['KOROTEYEV K.N.', 'PEREDRUK A.D.']",FALSE,,"['MAYZULS AND OTHERS', 'RUSSIA']",Violation of Article 11 - Freedom of assembly and association (Article 11-1 - Freedom of peaceful assembly);Violation of Article 5 - Right to liberty and security (Article 5-1 - Lawful arrest or detention);Violation of Article 6 - Right to a fair trial (Article 6 - Administrative proceedings;Article 6-1 - Impartial tribunal),5;5-1;6;6-1;11;11-1,"['5', '11', '5-1', '6', '11-1', '6-1']"
501385,8148.5751953125,001-205218,CASE OF SHNEYDER AND OTHERS v. RUSSIA,HEJUD,MS WORD,19126/11;59752/11;76684/11;4876/15;30367/15;55308/15,"[{'element': 'Violation of Article 11 - Freedom of assembly and association', 'details': ['Article 11-1 - Freedom of peaceful assembly'], 'type': 'violation', 'article': '11', 'base_article': '11'}, {'element': 'Violation of Article 5 - Right to liberty and security', 'details': ['Article 5-1 - Lawful arrest or detention'], 'type': 'violation', 'article': '5', 'base_article': '5'}, {'element': 'Violation of Article 6 - Right to a fair trial', 'details': ['Article 6 - Administrative proceedings', 'Article 6-1 - Fair hearing'], 'type': 'violation', 'article': '6', 'base_article': '6'}]",4,27,15,10/20/2020 12:00:00 AM,20/10/2020 00:00:00,"['CASELAW', 'JUDGMENTS', 'COMMITTEE', 'ENG']",CASELAW;JUDGMENTS;COMMITTEE;ENG,ENG,"['19126/11', '29580/12', '5865/07', '37553/05', '74552/01', '33482/06', '74568/12', '76204/11', '21613/07', '54381/08', '55308/15', '926/08', '57818/09', '30367/15', '76684/11', '4876/15', '59752/11']",False,COMMITTEE,RUS,38,ECLI:CE:ECHR:2020:1020JUD001912611,"['11', '6', '5']",,,[],,[],20/10/2020 00:00:00,448;220;445;13;136;145;151,,"['POLOZOVA A.B.', 'GOLUBOK S.A.', 'MOSKALENKO A.K.', 'PERSHAKOVA Y.Y.']",FALSE,,"['SHNEYDER AND OTHERS', 'RUSSIA']",Violation of Article 11 - Freedom of assembly and association (Article 11-1 - Freedom of peaceful assembly);Violation of Article 5 - Right to liberty and security (Article 5-1 - Lawful arrest or detention);Violation of Article 6 - Right to a fair trial (Article 6 - Administrative proceedings;Article 6-1 - Fair hearing),5;5-1;6;6-1;11;11-1,"['5', '11', '5-1', '6', '11-1', '6-1']"
501386,8148.5751953125,001-205219,CASE OF KOTLYARSKIY AND OTHERS v. RUSSIA,HEJUD,MS WORD,15024/12;15027/12;21041/12;21052/12;21056/12;21059/12;21065/12;21066/12;21068/12;21072/12;21096/12;21102/12;42535/12;57141/12,"[{'element': 'Violation of Article 11 - Freedom of assembly and association', 'details': ['Article 11-1 - Freedom of peaceful assembly'], 'type': 'violation', 'article': '11', 'base_article': '11'}, {'element': 'Violation of Article 3 - Prohibition of torture', 'details': ['Article 3 - Degrading treatment'], 'mentions': ['Substantive aspect'], 'type': 'violation', 'article': '3', 'base_article': '3'}, {'element': 'Violation of Article 5 - Right to liberty and security', 'details': ['Article 5-1 - Lawful arrest or detention'], 'type': 'violation', 'article': '5', 'base_article': '5'}, {'element': 'Violation of Article 6 - Right to a fair trial', 'details': ['Article 6 - Administrative proceedings', 'Article 6-1 - Impartial tribunal'], 'type': 'violation', 'article': '6', 'base_article': '6'}]",4,27,15,10/20/2020 12:00:00 AM,20/10/2020 00:00:00,"['CASELAW', 'JUDGMENTS', 'COMMITTEE', 'ENG']",CASELAW;JUDGMENTS;COMMITTEE;ENG,ENG,"['15024/12', '76204/11', '21041/12', '21052/12', '21056/12', '21059/12', '21065/12', '21066/12', '21068/12', '21072/12', '21096/12', '21102/12', '45875/06', '37553/05', '74552/01', '33482/06', '74568/12', '21613/07', '57141/12', '54381/08', '926/08', '57818/09', '42535/12', '15027/12']",False,COMMITTEE,RUS,38,ECLI:CE:ECHR:2020:1020JUD001502412,"['11', '3', '6', '5']",,,[],,[],20/10/2020 00:00:00,350;90;448;220;445;13;180;145;151,,"['YERMOLAYEVA N.V.', 'NAVALNYY A.A.', 'TEREKHOV K.I.', 'SHARAPOV I.I.', 'DAVIDYAN E.G.', 'YANATYEVA I.B.', 'MEMORIAL HUMAN RIGHTS CENTRE', 'EUROPEAN HUMAN RIGHTS ADVOCACY CENTRE (“EHRAC”)']",FALSE,,"['KOTLYARSKIY AND OTHERS', 'RUSSIA']",Violation of Article 11 - Freedom of assembly and association (Article 11-1 - Freedom of peaceful assembly);Violation of Article 3 - Prohibition of torture (Article 3 - Degrading treatment) (Substantive aspect);Violation of Article 5 - Right to liberty and security (Article 5-1 - Lawful arrest or detention);Violation of Article 6 - Right to a fair trial (Article 6 - Administrative proceedings;Article 6-1 - Impartial tribunal),3;5;5-1;6;6-1;11;11-1,"['5', '11', '5-1', '6', '3', '11-1', '6-1']"
501207,8000.1630859375,001-205060,CASE OF ZAKHAROV AND VARZHABETYAN v. RUSSIA,HEJUD,MS WORD,35880/14;75926/17,"[{'element': 'Violation of Article 3 - Prohibition of torture', 'details': ['Article 3 - Effective investigation'], 'mentions': ['Procedural aspect'], 'type': 'violation', 'article': '3', 'base_article': '3'}, {'element': 'Violation of Article 11 - Freedom of assembly and association', 'details': ['Article 11-1 - Freedom of peaceful assembly'], 'type': 'violation', 'article': '11', 'base_article': '11'}, {'element': 'Non-pecuniary damage - award', 'details': ['Article 41 - Non-pecuniary damage', 'Just satisfaction'], 'type': 'other'}]",3,6,15,10/13/2020 12:00:00 AM,13/10/2020 00:00:00,"['CASELAW', 'JUDGMENTS', 'CHAMBER', 'ENG']",CASELAW;JUDGMENTS;CHAMBER;ENG,ENG,"['35880/14', '75926/17', '74568/12', '46956/09', '46477/99', '42525/07', '60800/08', '49790/99', '72967/01', '10865/09', '23380/09', '71156/01', '55721/07', '43531/08', '39441/09', '41844/09', '36716/07', '22684/05', '75734/12', '57269/14', '26772/95', '5310/71', '29462/95', '30357/05', '76191/12', '5438/13', '16694/13', '32701/13', '69272/13', '37553/05', '74552/01', '33482/06', '61821/00', '17391/06', '8080/08', '8577/08', '2653/13', '60980/14', '42606/05']",False,CHAMBER,RUS,38,ECLI:CE:ECHR:2020:1013JUD003588014,"['11', '3', '41']",,,[],,"['Sections 20-22 of the Police Act (no. 3 of 7 February 2011, in force at the material time)']",13/10/2020 00:00:00,350;90;596;145;151;266;328;332;216;577;283,,"['MINENKOV S.A.', 'LAPTEV A.N.']",FALSE,"Al-Skeini and Others v. the United Kingdom [GC], no. 55721/07, § 165, ECHR 2011;Amine Güzel v. Turkey, no. 41844/09, § 39, 17 September 2013;Ananyev and Others v. Russia, nos. 42525/07 and 60800/08, § 72, 10 January 2012;Aristov and Gromov v. Russia [Committee], nos. 76191/12 and 5438/13, §§ 58-62, 9 October 2018;Asainov and Sibiryak v. Russia [Committee], nos. 16694/13 and 32701/13, §§ 50-53, 4 December 2018;Belevitskiy v. Russia, no. 72967/01, §§ 54-67, 1 March 2007;Biçici v. Turkey, no. 30357/05, §§ 35-36, 27 May 2010;Bouyid v. Belgium [GC], no. 23380/09, §§ 100-101, ECHR 2015;Ezelin v. France, 26 April 1991, §§ 39 and 53, Series A no. 202;Frumkin v. Russia, no. 74568/12, §§ 43-44, 5 January 2016;Gasanov v. the Republic of Moldova, no. 39441/09, § 50, 18 December 2012;Hyde Park and Others v. Moldova, no. 33482/06, 31 March 2009;Ireland v. the United Kingdom, no. 5310/71, § 161, 20 March 2018;İzci v. Turkey, no. 42606/05, § 82, 23 July 2013;Kudrevičius and Others v. Lithuania [GC], no. 37553/05, ECHR 2015;Labita v. Italy [GC], no. 26772/95, § 119, ECHR 2000-IV;Lyapin v. Russia, no. 46956/09, §§ 128-40, 24 July 2014;Members of the Gldani Congregation of Jehovah’s Witnesses and Others v. Georgia, no. 71156/01, § 97, 3 May 2007;Mesut Deniz v. Turkey, no. 36716/07, § 52, 5 November 2013;Mocanu and Others v. Romania [GC], nos. 10865/09 and 2 others, §§ 264-69, ECHR 2014 (extracts);Muradova v. Azerbaijan, no. 22684/05, §§ 107-114, 2 April 2009;Oya Ataman v. Turkey, no. 74552/01, ECHR 2006 XIV;Paul and Audrey Edwards v. the United Kingdom (dec.), no. 46477/99, 7 June 2001;Primov and Others v. Russia, no. 17391/06, § 155, 12 June 2014;Razvozzhayev v. Russia and Ukraine and Udaltsov v. Russia, nos. 75734/12 and 2 others, §§ 137 and 282-286, 19 November 2019;Rehbock v. Slovenia, no. 29462/95, § 72, ECHR 2000 XII;Samesov v. Russia, no. 57269/14, § 51, 20 November 2018;Schwabe and M.G. v. Germany, nos. 8080/08 and 8577/08, § 103, ECHR 2011;Trubnikov v. Russia (dec.), no. 49790/99, 14 October 2003;Velev v. Bulgaria, no. 43531/08, § 60, 16 April 2013;Yaroslav Belousov v. Russia, nos. 2653/13 and 60980/14, §§ 168-172, 4 October 2016;Ziliberberg v. Moldova (dec.), no. 61821/00, 4 May 2004;Zinovyeva v. Russia [Committee], no. 69272/13, § 53, 8 January 2019","['ZAKHAROV AND VARZHABETYAN', 'RUSSIA']",Violation of Article 3 - Prohibition of torture (Article 3 - Degrading treatment) (Substantive aspect);Violation of Article 3 - Prohibition of torture (Article 3 - Effective investigation) (Procedural aspect);Violation of Article 11 - Freedom of assembly and association (Article 11-1 - Freedom of peaceful assembly);Non-pecuniary damage - award (Article 41 - Non-pecuniary damage;Just satisfaction),3;11;11-1;11-2;41,"['11', '3', '11-2', '11-1', '41']"
501211,7997.1630859375,001-205065,CASE OF SOZAYEV AND OTHERS v. RUSSIA,HEJUD,MS WORD,67685/14;35199/15,"[{'element': 'Violation of Article 11 - Freedom of assembly and association', 'details': ['Article 11-1 - Freedom of peaceful assembly'], 'type': 'violation', 'article': '11', 'base_article': '11'}, {'element': 'Violation of Article 5 - Right to liberty and security', 'details': ['Article 5-1 - Lawful arrest or detention'], 'type': 'violation', 'article': '5', 'base_article': '5'}, {'element': 'Violation of Article 6 - Right to a fair trial', 'details': ['Article 6 - Administrative proceedings', 'Article 6-1 - Impartial tribunal'], 'type': 'violation', 'article': '6', 'base_article': '6'}]",4,27,15,10/13/2020 12:00:00 AM,13/10/2020 00:00:00,"['CASELAW', 'JUDGMENTS', 'COMMITTEE', 'ENG']",CASELAW;JUDGMENTS;COMMITTEE;ENG,ENG,"['67685/14', '35199/15', '29580/12', '57818/09', '5865/07', '37553/05', '74552/01', '33482/06', '74568/12', '76204/11', '21613/07', '54381/08', '926/08', '72881/01', '25501/07']",False,COMMITTEE,RUS,38,ECLI:CE:ECHR:2020:1013JUD006768514,"['11', '6', '5']",,,[],,[],13/10/2020 00:00:00,448;220;445;13;180;145;151,,"['GLUSHKOVA T.S.', 'KOROTEYEV K.N.']",FALSE,,"['SOZAYEV AND OTHERS', 'RUSSIA']",Violation of Article 11 - Freedom of assembly and association (Article 11-1 - Freedom of peaceful assembly);Violation of Article 5 - Right to liberty and security (Article 5-1 - Lawful arrest or detention);Violation of Article 6 - Right to a fair trial (Article 6 - Administrative proceedings;Article 6-1 - Impartial tribunal),5;5-1;6;6-1;11;11-1,"['5', '11', '5-1', '6', '11-1', '6-1']"
