sharepointid,Rank,itemid,docname,doctype,application,appno,conclusion,importance,originatingbody,typedescription,kpdate,kpdateAsText,documentcollectionid,documentcollectionid2,languageisocode,extractedappno,isplaceholder,doctypebranch,respondent,respondentOrderEng,ecli,article,applicability,decisiondate,externalsources,introductiondate,issue,judgementdate,kpthesaurus,meetingnumber,representedby,separateopinion,scl,parties,conclusion_detail,articles_detail,paragraphs
468073,2029.625,001-177124,CASE OF TURAL HAJIBEYLI v. AZERBAIJAN,HEJUD,MS WORD,69180/11,"[{'element': 'Violation of Article 11 - Freedom of assembly and association', 'details': ['Article 11-1 - Freedom of peaceful assembly'], 'type': 'violation', 'article': '11', 'base_article': '11'}, {'element': 'Violation of Article 6+6-3 - Right to a fair trial', 'details': ['Article 6 - Administrative proceedings', 'Article 6-1 - Fair hearing'], 'mentions': ['Article 6 - Right to a fair trial', 'Article 6-3 - Rights of defence'], 'type': 'violation', 'article': '6-3', 'base_article': '6'}, {'element': 'Violation of Article 5 - Right to liberty and security', 'details': ['Article 5-1 - Lawful arrest or detention'], 'type': 'violation', 'article': '5', 'base_article': '5'}, {'element': 'Violation of Article 34 - Individual applications', 'details': ['Article 34 - Hinder the exercise of the right of application'], 'type': 'violation', 'article': '34', 'base_article': '34'}]",4,29,15,9/28/2017 12:00:00 AM,28/09/2017 00:00:00,"['CASELAW', 'JUDGMENTS', 'COMMITTEE', 'ENG']",CASELAW;JUDGMENTS;COMMITTEE;ENG,ENG,"['69180/11', '68762/14', '60259/11', '58510/00', '69889/01', '11370/02', '35093/05', '69234/11', '69252/11', '69335/11', '67360/11', '67964/11', '69379/11', '2204/11', '40984/07']",False,COMMITTEE,AZE,5,ECLI:CE:ECHR:2017:0928JUD006918011,"['34', '11', '6', '5']",,,[],,[],28/09/2017 00:00:00,448;220;445;13;136;440;145;151;183;177,,"['ALIYEV I.', 'BAGIROV K.']",FALSE,,"['TURAL HAJIBEYLI', 'AZERBAIJAN']",Violation of Article 11 - Freedom of assembly and association (Article 11-1 - Freedom of peaceful assembly);Violation of Article 6+6-3 - Right to a fair trial (Article 6 - Administrative proceedings;Article 6-1 - Fair hearing) (Article 6 - Right to a fair trial;Article 6-3 - Rights of defence);Violation of Article 5 - Right to liberty and security (Article 5-1 - Lawful arrest or detention);Violation of Article 34 - Individual applications (Article 34 - Hinder the exercise of the right of application),5;5-1;6;6+6-3;6-1;6-3;11;11-1;34,"['6-3', '5', '11', '5-1', '6', '34', '11-1', '6-1']"
436115,1071.48986816406,001-140004,CASE OF ASSOCIATION OF VICTIMS OF ROMANIAN JUDGES AND OTHERS v. ROMANIA,HEJUD,MS WORD,47732/06,"[{'element': 'Violation of Article 11 - Freedom of assembly and association', 'details': ['Article 11-1 - Freedom of association'], 'type': 'violation', 'article': '11', 'base_article': '11'}, {'element': 'Pecuniary and non-pecuniary damage - award', 'type': 'other'}]",3,6,15,1/14/2014 12:00:00 AM,14/01/2014 00:00:00,"['CASELAW', 'JUDGMENTS', 'CHAMBER', 'ENG']",CASELAW;JUDGMENTS;CHAMBER;ENG,ENG,"['47732/06', '2162/05', '35097/02', '44158/98', '41340/98', '41342/98', '41343/98', '41344/98', '20641/05', '46626/99', '24057/03', '40269/02']",False,CHAMBER,ROU,37,ECLI:CE:ECHR:2014:0114JUD004773206,"['11', '35', '41']",,,[],,"['Article 40 § 2 of the Constitution', 'Article 9 of Government Ordinance no. 26/2000']",14/01/2014 00:00:00,145;146;266;332;375;14;216;238;354,,['NEAGU R.'],FALSE,"Bota v. Romania, (dec.), no. 24057/03, 12 October 2004;Bozgan v. Romania, no. 35097/02, § 23, 11 October 2007;Eğitim ve Bilim Emekçileri Sendikası v. Turkey, no. 20641/05, § 49, ECHR 2012;Gorzelik and Others v. Poland [GC], no. 44158/98, §§ 88-93, ECHR 2004 I;Koretskyy and Others v. Ukraine, no. 40269/02, §§ 54- 55, 3 April 2008;Partidul Comunistilor (Nepeceristi) and Ungureanu v. Romania, no. 46626/99, § 49, ECHR 2005 I;Refah Partisi (the Welfare Party) and Others v. Turkey [GC], nos. 41340/98, 41342/98, 41343/98 and 41344/98, ECHR 2003 II;Sidiropoulos and Others v. Greece, 10 July 1998, Reports of Judgments and Decisions 1998 IV;The Argeş College of Legal Advisers v. Romania, no. 2162/05, § 37, 8 March 2011
","['ASSOCIATION OF VICTIMS OF ROMANIAN JUDGES AND OTHERS', 'ROMANIA']",Remainder inadmissible;Violation of Article 11 - Freedom of assembly and association (Article 11-1 - Freedom of association);Pecuniary and non-pecuniary damage - award,11;11-1;11-2;35;41,"['11', '11-2', '11-1', '35', '41']"
450279,1288.39123535156,001-154400,CASE OF IDENTOBA AND OTHERS v. GEORGIA,HEJUD,MS WORD,73235/12,"[{'element': 'Violation of Article 14+3 - Prohibition of discrimination', 'details': ['Article 14 - Discrimination'], 'mentions': ['Article 3 - Degrading treatment', 'Inhuman treatment', 'Prohibition of torture', 'Effective investigation', 'Positive obligations'], 'type': 'violation', 'article': '3', 'base_article': '3'}, {'element': 'Violation of Article 14+3 - Prohibition of discrimination', 'details': ['Article 14 - Discrimination'], 'mentions': ['Article 3 - Degrading treatment', 'Inhuman treatment', 'Prohibition of torture', 'Effective investigation', 'Positive obligations'], 'type': 'violation', 'article': '14', 'base_article': '14'}, {'element': 'Violation of Article 14+11 - Prohibition of discrimination', 'details': ['Article 14 - Discrimination'], 'mentions': ['Article 11 - Freedom of assembly and association', 'Positive obligations', 'Article 11-1 - Freedom of peaceful assembly'], 'type': 'violation', 'article': '11', 'base_article': '11'}, {'element': 'Violation of Article 14+11 - Prohibition of discrimination', 'details': ['Article 14 - Discrimination'], 'mentions': ['Article 11 - Freedom of assembly and association', 'Positive obligations', 'Article 11-1 - Freedom of peaceful assembly'], 'type': 'violation', 'article': '14', 'base_article': '14'}, {'element': 'Non-pecuniary damage - award', 'details': ['Article 41 - Non-pecuniary damage', 'Just satisfaction'], 'type': 'other'}]",3,7,15,5/12/2015 12:00:00 AM,12/05/2015 00:00:00,"['CASELAW', 'JUDGMENTS', 'CHAMBER', 'ENG']",CASELAW;JUDGMENTS;CHAMBER;ENG,ENG,"['73235/12', '72377/01', '37330/02', '26698/05', '11921/86', '29381/09', '32684/09', '65542/12', '53430/99', '45053/98', '72713/01', '8440/78', '1484/07', '6991/08', '15084/08', '15250/02', '47159/08', '28490/02', '26827/08', '22978/05', '3564/11', '33985/96', '33986/96', '4403/70', '41138/98', '64320/01', '4672/02', '26608/11', '39272/98', '42722/02', '43577/98', '43579/98', '71156/01', '74839/10', '44614/07', '38478/05', '36505/02', '44158/98', '52562/99', '52620/99', '40721/08', '30668/96', '30671/96', '30678/96', '74989/01', '1543/06', '33290/96', '4916/07', '25924/08', '14599/09', '35159/09', '18768/05', '31973/03', '30587/13']",False,CHAMBER,GEO,17,ECLI:CE:ECHR:2015:0512JUD007323512,"['10', '11', '3', '14', '35', '41']",,,[],,"['Articles 125, 151 and 161 of the Criminal Code']",12/05/2015 00:00:00,350;90;596;193;633;149;148;145;645;151;343;100;14;216;577;283,,"['ASATIANI L.', 'BOLKVADZE N.']",TRUE,"A. v. the United Kingdom, 23 September 1998, § 22, Reports of Judgments and Decisions 1998‑VI;Abdu v. Bulgaria, no. 26827/08, 11 March 2014;Alekseyev v. Russia, nos. 4916/07, 25924/08 and 14599/09, § 108, 21 October 2010;Association des Amis de Saint-Raphaël et de Fréjus and Others v. France (dec.), no. 45053/98, 29 February 2000;August v. the United Kingdom (dec.), no. 36505/02, 21 January 2003;B.S. v. Spain, no. 47159/08, §§ 59 63, 24 July 2012;Bączkowski and Others v. Poland, no. 1543/06, § 64, 3 May 2007;Begheluri and Others v. Georgia, no. 28490/02, §§ 171 79, 7 October 2014;Bekos and Koutropoulos v. Greece, no. 15250/02, § 70, ECHR 2005 XIII (extracts);Cardot v. France, 19 March 1991, § 34, Series A no. 200;Christians against Racism and Fascism v. the United Kingdom, no. 8440/78, Commission decision of 16 July 1980, Decisions and Reports 21, p. 138;Costello-Roberts v. the United Kingdom, 25 March 1993, § 30, Series A no. 247 C;Defalque v. Belgium, no. 37330/02, § 46, 20 April 2006;East African Asians v. the United Kingdom, nos. 4403/70 et al., Commission’s report of 14 December 1973, Decisions and Reports 78, p. 5, § 208;Eremia v. the Republic of Moldova, no. 3564/11, § 54, 28 May 2013;Ezelin v. France, 26 April 1991, §§ 35 and 37, Series A no. 202;Fáber v. Hungary, no. 40721/08, §§ 37 41, 24 July 2012;Farbtuhs v. Latvia, no. 4672/02, § 54, 2 December 2004;Fédération chrétienne des témoins de Jéhovah de France v. France (dec.), no. 53430/99, ECHR 2001-XI;Gäfgen v. Germany [GC], no. 22978/05, § 103, 1 June 2010;Gorzelik and Others v. Poland [GC], no. 44158/98, § 92, 17 February 2004;Hyde Park and Others v. Moldova (nos. 5 and 6), nos. 6991/08 and 15084/08, § 32, 14 September 2010;Informationsverein Lentia and Others v. Austria, judgment of 24 November 1993, Series A no. 276, p. 16, § 38;Kakabadze and Others v. Georgia, no. 1484/07, § 83, 2 October 2012;Lazariu v. Romania, no. 31973/03, § 88, 13 November 2014;M.C. v. Bulgaria, no. 39272/98, ECHR 2003‑XII;Members of the Gldani Congregation of Jehovah’s Witnesses and Others v. Georgia, no. 71156/01, §§ 138-42, 3 May 2007;Milanović v. Serbia, no. 44614/07, §§ 84 and 89, 14 December 2010;Moldovan and Others v. Romania (no. 2), nos. 41138/98 and 64320/01, § 111, ECHR 2005 VII (extracts);Mudric v. the Republic of Moldova, no. 74839/10, §§ 60-64, 16 July 2013;Nachova and Others v. Bulgaria [GC], nos. 43577/98 and 43579/98, § 160, ECHR 2005‑VII;Ouranio Toxo v. Greece, no. 74989/01, § 37, 20 October 2005;P.V. v. France, no. 38305/97, § 37, 14 November 2000;Plattform “Ärzte für das Leben” v. Austria, 21 June 1988, Series A no. 139;Saghinadze and Others v. Georgia, no. 18768/05, §§ 95 and 96, 27 May 2010;Salgueiro da Silva Mouta v. Portugal, no. 33290/96, § 28, ECHR 1999 IX;Sandra Janković v. Croatia, no. 38478/05, § 36, 5 March 2009;SARL du Parc d’Activités de Blotzheim v. France, no. 72377/01, § 20, 11 July 2006;Smith and Grady v. the United Kingdom, nos. 33985/96 and 33986/96, § 121, ECHR 1999 VI;Sørensen and Rasmussen v. Denmark [GC], nos. 52562/99 and 52620/99, § 58, ECHR 2006 I;Stichting Mothers of Srebrenica and Others v. the Netherlands (dec.), no. 65542/12, §§ 115-116, ECHR 2013 (extracts);Stoica v. Romania, no. 42722/02, § 67, 4 March 2008;T.M. and C.M. v. the Republic of Moldova, no. 26608/11, § 38, 28 January 2014;Tourkiki Enosi Xanthis and Others v. Greece, no. 26698/05, § 38, 27 March 2008;Ukrainian Media Group v. Ukraine, no. 72713/01, §§ 38-70, 29 March 2005;Vallianatos and Others v. Greece [GC], nos. 29381/09 and 32684/09, § 47, ECHR 2013 (extracts);Van Oosterwijck v. Belgium, 6 November 1980, § 35, Series A no. 40;Van Raalte v. the Netherlands, 21 February 1997, § 33, Reports of Judgments and Decisions 1997 I;Verein “Kontakt-Information-Therapie” (KIT) and Siegfried HAGEN v. Austria, no. 11921/86, Commission decision of 12 October 1986, Decisions and Reports (DR) No. 57-A, p. 81;Wilson and the National Union of Journalists and Others v. the United Kingdom, nos. 30668/96, 30671/96 and 30678/96, § 41, ECHR 2002‑V;Young, James and Webster v. the United Kingdom, 13 August 1981, Series A no. 44, p. 25, § 63","['IDENTOBA AND OTHERS', 'GEORGIA']",Remainder inadmissible;Violation of Article 14+3 - Prohibition of discrimination (Article 14 - Discrimination) (Article 3 - Degrading treatment;Inhuman treatment;Prohibition of torture;Effective investigation;Positive obligations);Violation of Article 14+11 - Prohibition of discrimination (Article 14 - Discrimination) (Article 11 - Freedom of assembly and association;Positive obligations;Article 11-1 - Freedom of peaceful assembly);Non-pecuniary damage - award (Article 41 - Non-pecuniary damage;Just satisfaction),3;10;10-1;11;11-1;14;14+11;14+3;35;41,"['10-1', '10', '11', '3', '14', '11-1', '35', '41']"
421579,1285.70141601563,001-154161,CASE OF EMIN HUSEYNOV v. AZERBAIJAN,HEJUD,MS WORD,59135/09,"[{'element': 'Violation of Article 3 - Prohibition of torture', 'details': ['Article 3 - Effective investigation'], 'mentions': ['Procedural aspect'], 'type': 'violation', 'article': '3', 'base_article': '3'}, {'element': 'Violation of Article 5 - Right to liberty and security', 'details': ['Article 5-1 - Deprivation of liberty'], 'type': 'violation', 'article': '5', 'base_article': '5'}, {'element': 'Violation of Article 11 - Freedom of assembly and association', 'details': ['Article 11-1 - Freedom of peaceful assembly'], 'type': 'violation', 'article': '11', 'base_article': '11'}, {'element': 'Non-pecuniary damage - award', 'details': ['Article 41 - Just satisfaction'], 'type': 'other'}]",3,4,15,5/7/2015 12:00:00 AM,07/05/2015 00:00:00,"['CASELAW', 'JUDGMENTS', 'CHAMBER', 'ENG']",CASELAW;JUDGMENTS;CHAMBER;ENG,ENG,"['59135/09', '130/90', '120/70', '25803/94', '30210/96', '28524/95', '25657/94', '28883/95', '22684/05', '31805/06', '26772/95', '2594/07', '22062/07', '33097/96', '57834/00', '39692/09', '40713/09', '41008/09', '4158/05', '30194/09', '28940/95', '13229/03', '52792/99', '20652/92', '16072/06', '27809/08', '25/02', '10877/04', '74989/01', '38187/97']",False,CHAMBER,AZE,5,ECLI:CE:ECHR:2015:0507JUD005913509,"['11', '3', '41', '5']",,,[],,['Law on Freedom of Assembly'],07/05/2015 00:00:00,350;90;596;193;448;93;145;151;317;216;577,,"['HAJILI R.', 'SADIGOV E.']",FALSE,"Adalı v. Turkey, no. 38187/97, § 267, 31 March 2005;Assenov and Others v. Bulgaria, 28 October 1998, Reports of Judgments and Decisions 1998 VIII;Austin and Others v. the United Kingdom [GC], nos. 39692/09, 40713/09 and 41008/09, § 57, ECHR 2012;Avşar v. Turkey, no. 25657/94, ECHR 2001-VII;Balçık and Others v. Turkey, no. 25/02, § 44, 29 November 2007;Batı and Others v. Turkey, nos. 33097/96 and 57834/00, §§ 134 and 137, ECHR 2004 IV;Bozano v. France, 18 December 1986, § 54, Series A no. 111;Djavit An v. Turkey, no. 20652/92, ECHR 2003 III;Foka v. Turkey, no. 28940/95, §§ 74-79, 24 June 2008;Friend, the Countryside Alliance and others v. the United Kingdom (dec.), nos. 16072/06 and 27809/08, § 50, 24 November 2009;Gillan and Quinton v. the United Kingdom, no. 4158/05, ECHR 2010 (extracts);Guzzardi v. Italy, 6 November 1980, § 92, Series A no. 39;Ireland v. the United Kingdom, 18 January 1978, § 162, Series A no. 25;Kudła v. Poland [GC], no. 30210/96, ECHR 2000-XI;Labita v. Italy [GC], no. 26772/95, § 131, ECHR 2000 IV;Layijov v. Azerbaijan, no. 22062/07, 10 April 2014;McKerr v. the United Kingdom (dec.), no. 28883/95, 4 April 2000;Muradova v. Azerbaijan, no. 22684/05, 2 April 2009;Najafli v. Azerbaijan, no. 2594/07, § 52, 2 October 2012;Ouranio Toxo v. Greece, no. 74989/01, § 36, ECHR 2005 X (extracts);Peers v. Greece, no. 28524/95, § 67, ECHR 2001-III;Rizvanov v. Azerbaijan, no. 31805/06, §§ 46-48, 17 April 2012;Saadi v. the United Kingdom [GC], no. 13229/03, § 67, ECHR 2008;Selmouni v. France [GC], no. 25803/94, ECHR 1999 V;Sergey Kuznetsov v. Russia, no. 10877/04, § 37, 23 October 2008;Shimovolos v. Russia, no. 30194/09, §§ 48-50, 21 June 2011;Tomasi v. France, 27 August 1992, §§ 108-11, Series A no. 241 A;Vasileva v. Denmark, no. 52792/99, §§ 36-38, 25 September 2003;Wassink v. the Netherlands, 27 September 1990, § 24, Series A no. 185 A","['EMIN HUSEYNOV', 'AZERBAIJAN']",Violation of Article 3 - Prohibition of torture (Article 3 - Degrading treatment;Inhuman treatment) (Substantive aspect);Violation of Article 3 - Prohibition of torture (Article 3 - Effective investigation) (Procedural aspect);Violation of Article 5 - Right to liberty and security (Article 5-1 - Deprivation of liberty);Violation of Article 11 - Freedom of assembly and association (Article 11-1 - Freedom of peaceful assembly);Non-pecuniary damage - award (Article 41 - Just satisfaction),3;5;5-1;11;11-1;11-2;41,"['5', '11', '5-1', '3', '11-2', '11-1', '41']"
471845,2215.80444335938,001-180501,CASE OF BARABANOV v. RUSSIA,HEJUD,MS WORD,4966/13;5550/15,"[{'element': 'Remainder inadmissible', 'details': ['Article 35-3-a - Manifestly ill-founded'], 'type': 'other'}, {'element': 'Violation of Article 5 - Right to liberty and security', 'details': ['Article 5-4 - Speediness of review'], 'type': 'violation', 'article': '5', 'base_article': '5'}, {'element': 'Violation of Article 11 - Freedom of assembly and association', 'details': ['Article 11-1 - Freedom of peaceful assembly'], 'type': 'violation', 'article': '11', 'base_article': '11'}, {'element': 'Non-pecuniary damage - award', 'details': ['Article 41 - Non-pecuniary damage', 'Just satisfaction'], 'type': 'other'}]",3,6,15,1/30/2018 12:00:00 AM,30/01/2018 00:00:00,"['CASELAW', 'JUDGMENTS', 'CHAMBER', 'ENG']",CASELAW;JUDGMENTS;CHAMBER;ENG,ENG,"['4966/13', '5550/15', '74568/12', '2653/13', '60980/14', '51445/09', '30983/02', '37509/05', '23755/07', '13008/13', '19554/05', '5829/04', '14945/03', '6110/03', '7923/04', '21613/07', '17526/10', '17391/06', '50841/99', '71386/10', '39221/98', '41963/98', '39748/98', '50959/99', '37553/05']",False,CHAMBER,RUS,38,ECLI:CE:ECHR:2018:0130JUD000496613,"['10', '5', '11', '35', '41']",,,[],,['Articles 212 and 318 of the Criminal Code'],30/01/2018 00:00:00,448;404;474;149;156;145;151;266;328;332;375;14;236;216;577;283;238;354,,"['SIDORKINA S.I.', 'KHRUNOVA I.V.']",TRUE,"Artemov v. Russia, no. 14945/03, § 75, 3 April 2014;Butusov v. Russia, no. 7923/04, §§ 32-35, 22 December 2009;Buzadji v. the Republic of Moldova [GC], no. 23755/07, § 87, ECHR 2016 (extracts);Ezelin v. France, 26 April 1991, § 35, Series A no. 202;Frumkin v. Russia, no. 74568/12, §§ 100-01 and 134, 5 January 2016;Grishin v. Russia, no. 30983/02, § 83, 15 November 2007;Gülcü v. Turkey, no. 17526/10, § 116, 19 January 2016;Kasparov and Others v. Russia, no. 21613/07, §§ 82 83, 3 October 2013;Khodorkovskiy v. Russia, no. 5829/04, § 165, 31 May 2011;Kovyazin and Others v. Russia, nos. 13008/13 and 2 others, 17 September 2015;Kuptsov and Kuptsova v. Russia, no. 6110/03, § 107, 3 March 2011;Maestri v. Italy [GC], no. 39748/98, § 47, ECHR 2004 I;Odabaşı and Koçak v. Turkey, no. 50959/99, 21 February 2006;Osmani and Others v. the Former Yugoslav Republic of Macedonia (dec.), no. 50841/99, 11 October 2001;Primov and Others v. Russia, no. 17391/06, §§ 156-63, 12 June 2014;Savriddin Dzhurayev v. Russia, no. 71386/10, § 252, ECHR 2013 (extracts);Scozzari and Giunta v. Italy [GC], nos. 39221/98 and 41963/98, § 249, ECHR 2000-VIII;Taranenko v. Russia, no. 19554/05, 15 May 2014;Topal v. the Republic of Moldova (dec.), no. 37509/05, §§ 37-38, 18 March 2014;Yaroslav Belousov v. Russia, nos. 2653/13 and 60980/14, 4 October 2016","['BARABANOV', 'RUSSIA']",Remainder inadmissible (Article 35-3-a - Manifestly ill-founded);Violation of Article 5 - Right to liberty and security (Article 5-3 - Reasonableness of pre-trial detention);Violation of Article 5 - Right to liberty and security (Article 5-4 - Speediness of review);Violation of Article 11 - Freedom of assembly and association (Article 11-1 - Freedom of peaceful assembly);Non-pecuniary damage - award (Article 41 - Non-pecuniary damage;Just satisfaction),5;5-3;5-4;10;10-1;11;11-1;11-2;35;35-3-a;41,"['5-4', '10-1', '10', '5', '11', '5-3', '35-3-a', '11-2', '11-1', '35', '41']"
471838,2212.80444335938,001-180494,CASE OF YİGİN v. TURKEY,HEJUD,MS WORD,36643/09,"[{'element': 'Violation of Article 11 - Freedom of assembly and association', 'details': ['Article 11-1 - Freedom of peaceful assembly'], 'type': 'violation', 'article': '11', 'base_article': '11'}]",4,26,15,1/30/2018 12:00:00 AM,30/01/2018 00:00:00,"['CASELAW', 'JUDGMENTS', 'COMMITTEE', 'ENG']",CASELAW;JUDGMENTS;COMMITTEE;ENG,ENG,"['36643/09', '50171/09', '14495/11', '14531/11', '26274/11', '78923/11', '8408/12', '11848/12', '12078/12', '12103/12', '14745/12', '21910/12', '41087/12', '8077/08', '49197/06', '17526/10', '6813/09', '16853/05', '13304/03', '4870/02', '33347/04', '43807/07', '51962/12']",False,COMMITTEE,TUR,47,ECLI:CE:ECHR:2018:0130JUD003664309,['11'],,,[],,[],30/01/2018 00:00:00,145;151,,['DERIN K.'],FALSE,,"['YİGİN', 'TURKEY']",Violation of Article 11 - Freedom of assembly and association (Article 11-1 - Freedom of peaceful assembly),11;11-1,"['11', '11-1']"
445203,322.333984375,001-57906,CASE OF THE HOLY MONASTERIES v. GREECE,HEJUD,MS WORD,13092/87;13984/88,"[{'element': 'Preliminary objection rejected', 'details': ['non-exhaustion of domestic remedies'], 'type': 'other'}, {'element': 'Violation of Art. 6-1', 'type': 'violation', 'article': '6-1', 'base_article': '6'}, {'element': 'No violation of Art. 9', 'type': 'no-violation', 'article': '9', 'base_article': '9'}, {'element': 'No violation of Art. 11', 'type': 'no-violation', 'article': '11', 'base_article': '11'}, {'element': 'No violation of Art. 13', 'type': 'no-violation', 'article': '13', 'base_article': '13'}, {'element': 'No violation of Art. 14+6', 'type': 'no-violation', 'article': '6', 'base_article': '6'}, {'element': 'No violation of Art. 14+6', 'type': 'no-violation', 'article': '14', 'base_article': '14'}, {'element': 'No violation of Art. 14+9', 'type': 'no-violation', 'article': '9', 'base_article': '9'}, {'element': 'No violation of Art. 14+9', 'type': 'no-violation', 'article': '14', 'base_article': '14'}, {'element': 'No violation of Art. 14+11', 'type': 'no-violation', 'article': '11', 'base_article': '11'}, {'element': 'No violation of Art. 14+11', 'type': 'no-violation', 'article': '14', 'base_article': '14'}, {'element': 'No violation of Art. 14+P1-1', 'type': 'no-violation', 'article': 'p1-1', 'base_article': 'p1-1'}, {'element': 'No violation of Art. 14+P1-1', 'type': 'no-violation', 'article': '14', 'base_article': '14'}, {'element': 'Pecuniary damage - reserved', 'type': 'other'}, {'element': 'Costs and expenses award - Convention proceedings', 'type': 'other'}]",2,9,15,12/9/1994 12:00:00 AM,09/12/1994 00:00:00,"['CASELAW', 'JUDGMENTS', 'CHAMBER', 'ENG']",CASELAW;JUDGMENTS;CHAMBER;ENG,ENG,"['13092/87', '13984/88', '27/31', '147224/21']",False,CHAMBER,GRC,19,ECLI:CE:ECHR:1994:1209JUD001309287,"['11', '6', '13', 'p1-1', '14', '46', '9', '35']",,,[],,"['Law of 5 May 1987 regulating matters of Church property (""Law no. 1700/1987""), Sections 1, 2 and 3', 'Law of 6 October 1988 ""ratifying the agreement to transfer to the State the agricultural and forest property of the Holy Monasteries of the Greek Church which are parties to it"" (Law no. 1811/1988"")']",09/12/1994 00:00:00,14;128;26;126;214;145;146;154;152;343;100;369;94;304;445;7;444;110,,['N/A'],FALSE,"Airey v. Ireland judgment of 9 October 1979, Series A no. 32, p. 11, para. 19;Padovani v. Italy judgment of 26 February 1993, Series A no. 257-B, p. 20, para. 24;James and others v. United Kingdom judgment of 21 February 1986, Series A no. 98-B, p. 29, para. 37, p. 34, para. 50, p. 47, para. 85;Sporrong and Lönnroth v. Sweden judgment of 23 September 1982, Series A no. 52, p. 26, para. 69, p. 29, para. 79;Lithgow and others v. United Kingdom judgment of 8 July 1986, Series A no. 102, pp. 50-51, para. 121, p. 70, para. 192;Golder v. United Kingdom judgment of 21 February 1975, Series A no. 18, p. 18, para. 36;Le Compte, Van Leuven and De Meyere v. Belgium judgment of 23 June 1981, Series A no. 43, p. 20, para. 44;Philis v. Greece judgment of 27 August 1991, Series A no. 209, p. 23, para. 65;Fayed v. United Kingdom judgment of 21 September 1994, Series A no. 294-B, para. 65;Hoffmann v. Austria judgment of 23 June 1993, Series A no. 255-C, p. 58, para. 31","['THE HOLY MONASTERIES', 'GREECE']",Preliminary objection rejected (ratione personae);Preliminary objection rejected (non-exhaustion of domestic remedies);Violation of P1-1;Violation of Art. 6-1;No violation of Art. 9;No violation of Art. 11;No violation of Art. 13;No violation of Art. 14+6;No violation of Art. 14+9;No violation of Art. 14+11;No violation of Art. 14+P1-1;Pecuniary damage - reserved;Costs and expenses award - Convention proceedings,6;6-1;9;9-1;11;11-1;13;35;35-1;P1-1;P1-1-1;14+6;14;14+9;14+11;14+P1-1;46;46-2,"['9-1', '11', 'P1-1', '46-2', '6', '11-1', '13', 'P1-1-1', '14', '35-1', '46', '9', '35', '6-1']"
393737,1196.7607421875,001-147866,CASE OF ISLAM-ITTIHAD ASSOCIATION AND OTHERS v. AZERBAIJAN,HEJUD,MS WORD,5548/05,"[{'element': 'Violation of Article 11 - Freedom of assembly and association', 'details': ['Article 11-1 - Freedom of association'], 'type': 'violation', 'article': '11', 'base_article': '11'}]",4,4,15,11/13/2014 12:00:00 AM,13/11/2014 00:00:00,"['CASELAW', 'JUDGMENTS', 'CHAMBER', 'ENG']",CASELAW;JUDGMENTS;CHAMBER;ENG,ENG,"['5548/05', '4439/04', '22684/05', '44158/98', '37083/03', '39748/98', '44363/02', '30985/96', '25390/94', '25594/94', '37700/05']",False,CHAMBER,AZE,5,ECLI:CE:ECHR:2014:1113JUD000554805,['11'],,,[],,[],13/11/2014 00:00:00,145;146,,['BOWRING B.'],FALSE,,"['ISLAM-ITTIHAD ASSOCIATION AND OTHERS', 'AZERBAIJAN']",Violation of Article 11 - Freedom of assembly and association (Article 11-1 - Freedom of association),11;11-1,"['11', '11-1']"
