sharepointid,Rank,itemid,docname,doctype,application,appno,conclusion,importance,originatingbody,typedescription,kpdate,kpdateAsText,documentcollectionid,documentcollectionid2,languageisocode,extractedappno,isplaceholder,doctypebranch,respondent,respondentOrderEng,ecli,article,applicability,decisiondate,externalsources,introductiondate,issue,judgementdate,kpthesaurus,meetingnumber,representedby,separateopinion,scl,parties,conclusion_detail,articles_detail,paragraphs
396629,653.794494628906,001-89558,CASE OF DEMİR AND BAYKARA v. TURKEY,HEJUD,MS WORD,34503/97,"[{'element': 'Preliminary objection joined to merits and dismissed', 'details': ['ratione materiae'], 'type': 'other'}, {'element': 'Violations of Art. 11', 'type': 'violation', 'article': '11', 'base_article': '11'}, {'element': 'Damage - award', 'type': 'other'}, {'element': 'Non-pecuniary damage - award', 'type': 'other'}]",1,8,15,11/12/2008 12:00:00 AM,12/11/2008 00:00:00,"['CASELAW', 'JUDGMENTS', 'GRANDCHAMBER', 'ENG']",CASELAW;JUDGMENTS;GRANDCHAMBER;ENG,ENG,"['34503/97', '59532/00', '35763/97', '26629/95', '13229/03', '65731/01', '65900/01', '45036/98', '53924/00', '46827/99', '46951/99', '78028/01', '78030/01', '39051/03', '73316/01', '48939/99', '55066/00', '55638/00', '71251/01', '73333/01', '15250/02', '52435/99', '48254/99', '57325/00', '57671/00', '39483/98', '47095/99', '62393/00', '52562/99', '52620/99', '28957/95', '63235/00', '31253/96', '37112/97', '61827/00', '49517/99', '28602/95', '11603/85', '30668/96', '30671/96', '30678/96', '36022/97', '22723/93', '22724/93', '22725/93', '29529/95', '53574/99', '41340/98', '41342/98', '41343/98', '41344/98', '25803/94', '25141/94', '65659/01', '46295/99', '40403/02', '29556/02', '63252/00', '56079/00', '64886/01', '61166/00', '57220/00', '27928/02', '31694/02', '58698/00', '50278/99']",False,GRANDCHAMBER,TUR,47,ECLI:CE:ECHR:2008:1112JUD003450397,"['11', '35', '29', '41']",,,"['Articles 31 to 33 of the Vienna Convention on the Law of Treaties', 'Article 8-2 of the International Covenant on Economic, Social and Cultural Rights', 'Article 22 of the International Covenant on Civil and Political Rights', 'Article 2 of Convention No. 87 of the International Labour Organisation (ILO) on Freedom of Association and Protection of the Right to Organise', 'Individual Observation to the Turkish Government concerning Convention No. 87, adopted in 2005, the Committee of Experts on the Application of Conventions and Recommendations', 'ILO Committee on Freedom of Association', 'Article 5 and 6-2 of the European Social Charter (revised)', 'Principle no. 8 of Recommendation No. R (2000) 6 of the Committee of Ministers of the Council of Europe on the status of public officials in Europe', 'Article 12(1) and 28 of the European Union’s Charter of Fundamental Rights', 'Article 6 of the ILO Convention No. 98 concerning the Application of the Principles of the Right to Organise and to Bargain Collectively', 'Article 1-1 of the ILO Convention No. 151 concerning Protection of the Right to Organise and Procedures for Determining Conditions of Employment in the Public Service']",,"['Law no. 4688 on civil servants’ trade unions, 25 June 2001']",12/11/2008 00:00:00,14;398;145;141;146;202;246;266;332;310;216,,['KARADUMAN S.'],TRUE,"Aerts v. Belgium, 30 July 1998, § 42, Reports 1998-V;Al-Adsani v. the United Kingdom [GC], no. 35763/97, §§ 55, 60, ECHR 2001-XI;Bekos and Koutropoulos v. Greece, no. 15250/02, §§ 33-36, ECHR 2005-... (extracts);Blecic v. Croatia [GC], no. 59532/00, §§ 63-69, ECHR 2006-...;Bosphorus Hava Yollari Turizm ve Ticaret Anonim Sirketi (Bosphorus Airways) v. Ireland [GC], no. 45036/98, § 150, ECHR 2005-VI;Christine Goodwin v. the United Kingdom [GC], no. 28957/95, ECHR 2002-VI;Çiloglu and Others v. Turkey, no. 73333/01, § 17, 6 March 2007;Cobzaru v. Romania, no. 48254/99, §§ 49-50;Council of Civil Service Unions and Others v. Royaume uni, no. 11603/85, decision de la Commission du 20 January 1987, Décisions and rapports 50, p. 256;D.H. and Others v. the Czech Republic [GC], no. 57325/00, §§ 59-65, 184, 192, 200 and 205, ECHR 2007-...;Dicle pour le Party de la démocratie (DEP) v. Turkey, no. 25141/94, § 78, 10 December 2002;Emonet and Others v. Switzerland, no. 39051/03, §§ 65-66, ECHR 2007-...;Fogarty v. the United Kingdom [GC], no. 37112/97, ECHR 2001-XI;Francesco Schettini and Others v. Italy (dec.), no. 29529/95, 9 November 2000;Glass v. the United Kingdom, no. 61827/00, § 75, ECHR 2004-II;Golder v. the United Kingdom, 21 February 1975, §§ 29, 35, Series A no. 18;Gustafsson v. Sweden, § 45, Reports 1996-II;Hatton and Others v. the United Kingdom [GC], no. 36022/97, § 98, ECHR 2003-VIII;Ivanova v. Bulgaria, no. 52435/99, §§ 65-66, ECHR 2007-...;Johnston and Others v. Ireland, 18 December 1986, § 51 and suivants, Series A no. 112;Kadikis v. Latvia (no. 2), no. 62393/00, § 52, 4 May 2006;Kalashnikov v. Russia, no. 47095/99, § 97, ECHR 2002-VI;Lithgow and Others v. the United Kingdom, 8 July 1986, §§ 114 and 117, Series A no. 102;Mamatkoulov and Askarov v. Turkey [GC], nos. 46827/99 and 46951/99, § 121, ECHR 2005-I;Marckx v. Belgium, judgment of 13 June 1979, §§ 20 and 41, Series A no. 31;McElhinney v. Ireland [GC], no. 31253/96, ECHR 2001-XI;Nazarenko v. Ukraine, no. 39483/98, §§ 94-102, 29 April 2003;Öneryildiz v. Turkey [GC], no. 48939/99, §§ 59, 71, 90 and 93, ECHR 2004-XII;Party conservateur russe des entrepreneurs and Others v. Russia, nos. 55066/00 and 55638/00, §§ 70-73, ECHR 2007-...;Party nationaliste basque - Organisation régionale d’Iparralde v. France, no. 71251/01, §§ 45-52, ECHR 2007-...;Party présidentiel de Mordovie v. Russia, no. 65659/01, § 37, 5 October 2004;Pini and Others v. Romania, nos. 78028/01 and 78030/01, §§ 139 and 144, ECHR 2004-V (extracts);Refah Partisi (Party de la prospérité) and Others v. Turkey [GC], nos. 41340/98, 41342/98, 41343/98 and 41344/98, § 100, ECHR 2003-II;Saadi v. the United Kingdom [GC], no. 13229/03, § 62, ECHR 2008-...;Schmidt and Dahlström v. Sweden, judgment of 6 February 1976, §§ 34, 36, Series A no. 21;Selmouni v. France [GC], no. 25803/94, § 101, ECHR 1999-V;Sidiropoulos and Others v. Greece, 10 July 1998, § 40, Reports 1998-IV;Sigurður A. Sigurjónsson v. Iceland, 30 June 1993, § 35, Series A no. 264;Siliadin v. France, 26 October 2005, no. 73316/01, §§ 85-87, 89, ECHR 2005-VII;Slimani v. France, no. 57671/00, §§ 22 and suiv., ECHR 2004-IX (extracts);Soering v. Royaume Uni, judgment of 7 July 1989, § 102, Series A no. 161;Sørensen and Rasmussen v. Denmark [GC], nos. 52562/99 and 52620/99, §§ 58, 72-75, ECHR 2006-...;Stec and Others v. the United Kingdom (dec.) [GC], nos. 65731/01 and 65900/01, §§ 47-48, ECHR 2005-X;National Union of Belgian Police v. Belgium, 27 October 1975, §§ 38, 39, Series A no. 19;Swedish Engine Drivers'Union v. Sweden, 6 February 1976, §§ 37, 39, 40, Series A no. 20;Taskin and Others v. Turkey, no. 49517/99, §§ 99 and 119, 4 December 2003;Tüm Haber Sen and Çinar v. Turkey, no. 28602/95, §§ 29, 33-40, 50, ECHR 2006-...;UNISON v. the United Kingdom (dec.), no. 53574/99, ECHR 2002-I;Vilho Eskelinen and Others v. Finland [GC], no. 63235/00, § 56, ECHR 2007-...;Vo v. France [GC], no. 53924/00, § 82, ECHR 2004-VIII;Wilson, National Union of Journalists and Others v. the United Kingdom, nos. 30668/96, 30671/96 and 30678/96, §§ 41, 44, ECHR 2002-V;Witold Litwa v. Poland, no. 26629/95, §§ 57-59, ECHR 2000-III;Yazar and Others v. Turkey, nos. 22723/93, 22724/93 and 22725/93, § 51, ECHR 2002-II","['DEMİR AND BAYKARA', 'TURKEY']",Preliminary objection joined to merits and dismissed (ratione materiae);Violations of Art. 11;Damage - award;Non-pecuniary damage - award,11;11-1;11-2;29;29-3;35;35-3;41,"['29-3', '11', '11-2', '11-1', '35', '29', '41', '35-3']"
451580,653.646911621094,001-90340,CASE OF ALIYEV AND OTHERS v. AZERBAIJAN,HEJUD,MS WORD,28736/05,"[{'element': 'Violation of Article 11 - Freedom of assembly and association', 'type': 'violation', 'article': '11', 'base_article': '11'}]",4,4,15,12/18/2008 12:00:00 AM,18/12/2008 00:00:00,"['CASELAW', 'JUDGMENTS', 'CHAMBER', 'ENG']",CASELAW;JUDGMENTS;CHAMBER;ENG,ENG,"['28736/05', '4439/04', '44363/02', '4307/04', '25088/94', '28331/95', '28443/95', '39748/98', '38187/97', '25390/94', '30985/96']",False,CHAMBER,AZE,5,ECLI:CE:ECHR:2008:1218JUD002873605,['11'],,,[],,[],18/12/2008 00:00:00,145,,['ALIYEV I.'],FALSE,,"['ALIYEV AND OTHERS', 'AZERBAIJAN']",Violation of Article 11 - Freedom of assembly and association,11,['11']
350037,693.931274414063,001-94202,CASE OF CHRISTODOULIDOU v. TURKEY,HEJUD,MS WORD,16085/90,"[{'element': 'Violation of Article 3 - Prohibition of torture', 'details': ['Substantive aspect'], 'type': 'violation', 'article': '3', 'base_article': '3'}, {'element': 'No violation of Article 11 - Freedom of assembly and association', 'type': 'no-violation', 'article': '11', 'base_article': '11'}]",4,7,14,9/22/2009 12:00:00 AM,22/09/2009 00:00:00,"['CASELAW', 'JUDGMENTS', 'CHAMBER', 'ENG']",CASELAW;JUDGMENTS;CHAMBER;ENG,ENG,"['16085/90', '12/21', '12/22', '12/27', '5/72', '25781/94', '16219/90', '16162/90', '16163/90', '15299/89', '15300/89', '16084/90', '28940/95', '20652/92', '74552/01', '51346/99', '25691/04', '38595/97', '44587/98', '36832/97', '25760/94', '5881/02']",False,CHAMBER,TUR,47,ECLI:CE:ECHR:2009:0922JUD001608590,"['11', 'p1-1', '3']",,,[],,[],22/09/2009 00:00:00,350;145;369,,"['CLERIDES L.', 'CLERIDES C.']",TRUE,,"['CHRISTODOULIDOU', 'TURKEY']",Violation of Article 1 of Protocol No. 1 - Protection of property;Violation of Article 3 - Prohibition of torture (Substantive aspect);No violation of Article 11 - Freedom of assembly and association,3;11;P1-1,"['11', '3', 'P1-1']"
340737,570.069885253906,001-78954,CASE OF MKRTCHYAN v. ARMENIA,HEJUD,MS WORD,6562/03,"[{'element': 'Violation of Art. 11', 'type': 'violation', 'article': '11', 'base_article': '11'}]",4,6,15,1/11/2007 12:00:00 AM,11/01/2007 00:00:00,"['CASELAW', 'JUDGMENTS', 'CHAMBER', 'ENG']",CASELAW;JUDGMENTS;CHAMBER;ENG,ENG,"['6562/03', '25390/94', '28341/95', '39748/98', '68443/01']",False,CHAMBER,ARM,3,ECLI:CE:ECHR:2007:0111JUD000656203,['11'],,,[],,[],11/01/2007 00:00:00,145,,['BAGHDASARYAN N.'],FALSE,,"['MKRTCHYAN', 'ARMENIA']",Violation of Art. 11,11,['11']
401926,1085.39721679688,001-140910,CASE OF NOSOV AND OTHERS v. RUSSIA,HEJUD,MS WORD,9117/04;10441/04,"[{'element': 'Preliminary objection dismissed', 'details': ['Article 35-1 - Exhaustion of domestic remedies'], 'type': 'other'}, {'element': 'Violation of Article 6 - Right to a fair trial', 'details': ['Article 6 - Enforcement proceedings', 'Article 6-1 - Access to court'], 'type': 'violation', 'article': '6', 'base_article': '6'}, {'element': 'Violation of Article 1 of Protocol No. 1 - Protection of property', 'details': ['Article 1 para. 1 of Protocol No. 1 - Peaceful enjoyment of possessions'], 'type': 'violation', 'article': 'p1-1', 'base_article': 'p1-1'}, {'element': 'No violation of Article 11 - Freedom of assembly and association', 'details': ['Article 11-1 - Freedom of peaceful assembly'], 'type': 'no-violation', 'article': '11', 'base_article': '11'}, {'element': 'Non-pecuniary damage - award', 'type': 'other'}]",3,4,15,2/20/2014 12:00:00 AM,20/02/2014 00:00:00,"['CASELAW', 'JUDGMENTS', 'CHAMBER', 'ENG']",CASELAW;JUDGMENTS;CHAMBER;ENG,ENG,"['9117/04', '10441/04', '33509/04', '34578/97', '21417/04', '30672/03', '8549/06', '30385/07', '28541/95', '63235/00', '24770/04', '36813/97', '20937/07', '42538/02', '59498/00', '30616/05', '1543/06', '44079/98', '34202/06', '74552/01', '26986/03', '20652/92', '28793/02', '74989/01', '38187/97', '24876/94', '30562/04', '30566/04', '25691/04', '51346/99', '73333/01', '4563/07']",False,CHAMBER,RUS,38,ECLI:CE:ECHR:2014:0220JUD000911704,"['11', '6', '34', 'p1-1', '35', '41']",36,,[],,"['Federal Law № 68-ФЗ', 'Article 31 of the Constitution', 'Presidential Decree no. 524 of 25 May 1992', 'Decree of the Presidium of the USSR Supreme Council no. 9306-XI of 28 July 1988', 'Articles 1112, 1152, 1162 and 1183 of the Civil Code', 'Section 63 of the Federal Law on Pension Welfare of Military Service Personnel']",20/02/2014 00:00:00,445;113;7;145;151;266;332;375;183;498;14;128;216;369;304;238;354,,['N/A'],FALSE,"Adalı v. Turkey, no. 38187/97, § 267, 31 March 2005;Akashev v. Russia, no. 30616/05, §§ 21–23, 12 June 2008;Bączkowski and Others v. Poland, no. 1543/06, §§ 66-68, 3 May 2007;Berladir and Others v. Russia, no. 34202/06, §§ 47-51, 10 July 2012;Bukta and Others v. Hungary, no. 25691/04, § 37, ECHR 2007 III;Burdov v. Russia (no. 2), no. 33509/04, ECHR 2009;Burdov v. Russia, no. 59498/00, ECHR 2002-III;Christian Democratic People’s Party v. Moldova, no. 28793/02, §§ 62-63, ECHR 2006 II;Çiloğlu and Others v. Turkey, no. 73333/01, §§ 49-53, 6 March 2007;Cisse v. France, no. 51346/99, §§ 50-54, ECHR 2002 III;Coster v. the United Kingdom [GC], no. 24876/94, § 104, 18 January 2001;Djavit An v. Turkey, no. 20652/92, § 56, ECHR 2003 III;Ezelin v. France, 26 April 1991, Series A no. 202;Galstyan v. Armenia, no. 26986/03, 15 November 2007;Jėčius v. Lithuania, no. 34578/97, § 41, ECHR 2000 IX;Kazmin v. Russia, no. 42538/02, §§ 69-71, 13 January 2011;Moroko v. Russia, no. 20937/07, §§ 25-30, 12 June 2008;Ouranio Toxo and Others v. Greece, no. 74989/01, § 36, ECHR 2005 X (extracts);Oya Ataman v. Turkey, no. 74552/01, ECHR 2006 XIII;Ryabov and 151 other “Privileged pensioners” cases v. Russia, nos. 4563/07 et al., 17 December 2009;S. and Marper v. the United Kingdom [GC], nos. 30562/04 and 30566/04, § 101, ECHR 2008;Scordino v. Italy (no. 1) [GC], no. 36813/97, § 203, ECHR 2006 V;Shiryayeva v. Russia, no. 21417/04, §§ 8-9, 13 July 2006;Sobelin and Others v. Russia, nos. 30672/03 et al., §§ 43-45, 3 May 2007;Streltsov and other “Novocherkassk military pensioners” cases v. Russia, nos. 8549/06 et al., §§ 36-42, 29 July 2010;Szerdahelyi v. Hungary, no. 30385/07, §§ 19-22, 17 January 2012;The United Macedonian Organisation Ilinden and Ivanov v. Bulgaria, no. 44079/98, § 103, 20 October 2005;Ustalov v. Russia, no. 24770/04, § 13, 6 December 2007;Vilho Eskelinen and Others v. Finland [GC], no. 63235/00, § 62, ECHR 2007 II","['NOSOV AND OTHERS', 'RUSSIA']",Preliminary objection dismissed (Article 34 - Victim);Preliminary objection dismissed (Article 35-1 - Exhaustion of domestic remedies);Remainder inadmissible;Violation of Article 6 - Right to a fair trial (Article 6 - Enforcement proceedings;Article 6-1 - Access to court);Violation of Article 1 of Protocol No. 1 - Protection of property (Article 1 para. 1 of Protocol No. 1 - Peaceful enjoyment of possessions);No violation of Article 11 - Freedom of assembly and association (Article 11-1 - Freedom of peaceful assembly);Non-pecuniary damage - award,6;6-1;11;11-1;11-2;34;35;35-1;41;P1-1;P1-1-1,"['11', '41', 'P1-1', '6', '34', 'P1-1-1', '11-2', '35-1', '11-1', '35', '6-1']"
474118,2346.11352539063,001-182226,CASE OF TSUKANOV AND TORCHINSKIY v. RUSSIA,HEJUD,MS WORD,35000/13;35010/13,"[{'element': 'Violation of Article 5 - Right to liberty and security', 'details': ['Article 5-1 - Lawful arrest or detention'], 'type': 'violation', 'article': '5', 'base_article': '5'}, {'element': 'Violation of Article 6 - Right to a fair trial', 'details': ['Article 6 - Criminal proceedings', 'Article 6-1 - Impartial tribunal'], 'type': 'violation', 'article': '6', 'base_article': '6'}, {'element': 'Violation of Article 11 - Freedom of assembly and association', 'details': ['Article 11-1 - Freedom of peaceful assembly'], 'type': 'violation', 'article': '11', 'base_article': '11'}]",4,27,15,4/17/2018 12:00:00 AM,17/04/2018 00:00:00,"['CASELAW', 'JUDGMENTS', 'COMMITTEE', 'ENG']",CASELAW;JUDGMENTS;COMMITTEE;ENG,ENG,"['35000/13', '35010/13', '57818/09', '25501/07', '76204/11', '74568/12', '926/08', '46998/08']",False,COMMITTEE,RUS,38,ECLI:CE:ECHR:2018:0417JUD003500013,"['11', '6', '5']",,,[],,[],17/04/2018 00:00:00,448;220;445;76;180;145;151,,['TEREKHOV K.'],FALSE,,"['TSUKANOV AND TORCHINSKIY', 'RUSSIA']",Violation of Article 5 - Right to liberty and security (Article 5-1 - Lawful arrest or detention);Violation of Article 6 - Right to a fair trial (Article 6 - Criminal proceedings;Article 6-1 - Impartial tribunal);Violation of Article 11 - Freedom of assembly and association (Article 11-1 - Freedom of peaceful assembly),5;5-1;6;6-1;11;11-1,"['5', '11', '5-1', '6', '11-1', '6-1']"
473977,2340.08544921875,001-182170,"CASE OF BEKTASHI COMMUNITY AND OTHERS v. ""THE FORMER YUGOSLAV REPUBLIC OF MACEDONIA""",HEJUD,MS WORD,48044/10;75722/12;25176/13,"[{'element': 'Remainder inadmissible', 'details': ['Art. 35'], 'type': 'other'}, {'element': 'Admissibility criteria', 'details': ['Art. 35-3-a'], 'type': 'other'}, {'element': 'Violation of Article 11 - Freedom of assembly and association', 'details': ['Article 11-1 - Freedom of association'], 'type': 'violation', 'article': '11', 'base_article': '11'}, {'element': 'read in the light of Article 9 -', 'details': ['Art. 9'], 'type': 'other'}, {'element': 'Freedom of thought, conscience and religion', 'details': ['Article 9-1 - Freedom of religion'], 'type': 'other'}, {'element': 'Non-pecuniary damage - award', 'details': ['Article 41 - Non-pecuniary damage', 'Just satisfaction'], 'type': 'other'}]",3,4,15,4/12/2018 12:00:00 AM,12/04/2018 00:00:00,"['CASELAW', 'JUDGMENTS', 'CHAMBER', 'ENG']",CASELAW;JUDGMENTS;CHAMBER;ENG,ENG,"['48044/10', '75722/12', '25176/13', '223/97', '24/12', '39/77', '3532/07', '302/02', '18147/02', '55170/00', '50841/99', '37973/05', '67914/01', '17153/11', '70945/11', '72881/01', '45701/99', '76836/01', '32782/03', '40825/98', '35151/05', '34144/05', '1295/10', '44774/98', '58222/09', '70597/11', '34721/09', '16115/13', '67259/14', '58148/00', '39270/98', '36937/06']",False,CHAMBER,MKD,33,ECLI:CE:ECHR:2018:0412JUD004804410,"['11', '9', '35', '41']",,,[],,"['Religious Communities and Groups Act 1997 (1997 Act), Official Gazette no. 35/1997', 'Section 35(2) of the Legal Status of Churches, Religious Communities and Religious Groups Act 2007 (2007 Act), Official Gazette. no.113/2007']",12/04/2018 00:00:00,154;152;145;146;266;14;236;216;577;283,,"['GODZO A.', 'GODZO D.']",FALSE,"“Orthodox Ohrid Archdiocese (Greek-Orthodox Ohrid Archdiocese of the Peć Patriarchy)” v. the former Yugoslav Republic of Macedonia, no. 3532/07, § 61, 16 November 2017;Bekir-Ousta and Others v. Greece, no. 35151/05, § 14, 11 October 2007;Belchev v. Bulgaria, no. 39270/98, § 113, 8 April 2004;Church of Scientology Moscow v. Russia (dec.), no. 18147/02, 28 October 2004;Editions Plon v. France, no. 58148/00, § 64, ECHR 2004 – IV;Emin and Others v. Greece, no. 34144/05, § 10, 27 March 2008;Hajnal v. Serbia, no.36937/06, § 154, 19 June 2012;Jehovah Witnesses of Moscow v. Russia, no. 302/02, 10 June 2010;Juričić v. Croatia, no. 58222/09, § 87, 26 July 2011;Keskinen and Veljekset Keskinen Oy v. Finland, no. 34721/09, §§ 31 and 33, 5 June 2012;Kimlya and Others v. Russia, nos. 76836/01 and 32782/03, ECHR 2009;Leyla Şahin v. Turkey [GC], no. 44774/98, § 107, ECHR 2005 XI;Macedonian House of Civilization v. Greece, no. 1295/10, § 8, 9 July 2015;Magyar Keresztény Mennonita Egyház and Others v. Hungary, nos. 70945/11 and 8 others, §§ 75-80, ECHR 2014 (extracts);Margaretić v. Croatia, no. 16115/13, § 127, 5 June 2014;Meimanis v. Latvia, no. 70597/11, § 49, 21 July 2015;Metropolitan Church of Bessarabia and Others v. Moldova, no. 45701/99, § 106, ECHR 2001 XII;Moscow Branch of the Salvation Army v. Russia, no. 72881/01, ECHR 2006 XI;Religionsgemeinschaft der Zeugen Jehovas and Others v. Austria, no. 40825/98, 31 July 2008;Selmani and Others v. the former Yugoslav Republic of Macedonia, no. 67259/14, § 41, 9 February 2017;Vučković and Others v. Serbia (preliminary objection) [GC], nos. 17153/11 and 29 others, §§ 69-77, 25 March 2014","['BEKTASHI COMMUNITY AND OTHERS', '""THE FORMER YUGOSLAV REPUBLIC OF MACEDONIA""']","Remainder inadmissible (Art. 35) Admissibility criteria;(Art. 35-3-a) Manifestly ill-founded;Violation of Article 11 - Freedom of assembly and association (Article 11-1 - Freedom of association) read in the light of Article 9 - (Art. 9) Freedom of thought, conscience and religion (Article 9-1 - Freedom of religion);Non-pecuniary damage - award (Article 41 - Non-pecuniary damage;Just satisfaction)",9;9-1;11;11-1;11-2;35;35-3-a;41,"['9-1', '11', '11-1', '35-3-a', '11-2', '9', '35', '41']"
447778,221.13117980957,001-57608,"CASE OF YOUNG, JAMES AND WEBSTER v. THE UNITED KINGDOM",HEJUD,MS WORD,7601/76;7806/77,"[{'element': 'Violation of Art. 11', 'type': 'violation', 'article': '11', 'base_article': '11'}, {'element': 'No separate issue under Art. 9 and 10', 'type': 'other'}, {'element': 'No violation of Art. 13', 'type': 'no-violation', 'article': '13', 'base_article': '13'}, {'element': 'Just satisfaction reserved', 'type': 'other'}]",2,15,14,8/13/1981 12:00:00 AM,13/08/1981 00:00:00,"['CASELAW', 'JUDGMENTS', 'CHAMBER', 'ENG']",CASELAW;JUDGMENTS;CHAMBER;ENG,ENG,"['7601/76', '7806/77']",False,CHAMBER,GBR,49,ECLI:CE:ECHR:1981:0813JUD000760176,"['10', '11', '13', '1', '9']",,,"['Trade Union and Labour Relations Act 1974', 'Trade Union and Labour Relations (Amendment) Act 1976', 'Employment Act, 1980', 'Report of the Royal Commission on Trade Unions and Employers\' Associations, 1968 ""Brindlington Principles 1939""', 'United Nations Universal Declaration, Article 20 para. 2', 'Report of 19 June 1950 of the Conference of Senior Officials, Collected Edition of the ""Travaux Préparatoires"", vol. IV, p. 262']",,"['Trade Union and Labour Relations Act 1974', 'Trade Union and Labour Relations (Amendment) Act 1976']",13/08/1981 00:00:00,293;430;145;141;287;202;317;266;375;154;147;149;148;444;110,,['N/A'],TRUE,"National Union of Belgian Police judgment of 27 October 1975, Series A no. 19, pp. 17, 18, paras. 38, 39;Belgian linguistic case judgment of 23 July 1968, Series A no. 6, p. 32, para. 5;Golder judgment of 21 February 1975, Series A no. 18, p. 19, para. 38;Winterwerp judgment of 24 October 1979, Series A no. 33, p. 24, para. 60;Guzzardi judgment of 6 November 1980, Series A no. 39, pp. 31-32, para. 88;Airey judgment of 9 October 1979, Series A no. 32, p. 12, para. 24;Kjeldsen, Busk Madsen and Pedersen judgment of 7 December 1976, Series A no. 23, p. 26, para. 52;Sunday Times judgment of 26 April 1979, Series A no. 30, pp. 29, 30-31, 36, paras. 45, 46-49, 59;Handyside judgment of 7 December 1976, Series A no. 24, pp. 22, 23, paras. 48, 49","['YOUNG, JAMES AND WEBSTER', 'THE UNITED KINGDOM']",Violation of Art. 11;No separate issue under Art. 9 and 10;No violation of Art. 13;Just satisfaction reserved,11;11-1;11-2;9;9-1;10;10-1;13;1,"['9-1', '10', '10-1', '11', '13', '11-2', '1', '11-1', '9']"
447783,220.425964355469,001-57522,"CASE OF LE COMPTE, VAN LEUVEN AND DE MEYERE v. BELGIUM",HEJUD,MS WORD,6878/75;7238/75,"[{'element': 'Violation of Art. 6-1', 'type': 'violation', 'article': '6-1', 'base_article': '6'}, {'element': 'No violation of Art. 11', 'type': 'no-violation', 'article': '11', 'base_article': '11'}, {'element': 'Just satisfaction reserved', 'type': 'other'}]",2,15,14,6/23/1981 12:00:00 AM,23/06/1981 00:00:00,"['CASELAW', 'JUDGMENTS', 'CHAMBER', 'ENG']",CASELAW;JUDGMENTS;CHAMBER;ENG,ENG,"['6878/75', '7238/75', '7496/76']",False,CHAMBER,BEL,6,ECLI:CE:ECHR:1981:0623JUD000687875,"['11', '6']",41,,"['Belgian Constitution, Article 95', 'Act of 25 July 1938 on the creation of the ""Ordre des médecins""', 'Act of 31 March 1967', 'Royal Decree no. 79 of 10 November 1967 on the re-organisation of the ""Ordre des Médecins""', 'Royal Decree of 6 February 1970', 'Collected Edition of the ""Travaux Préparatoires"" of the European Convention on Human Rights, vol. II, p. 117-118']",,[],23/06/1981 00:00:00,445;41;136;7;180;181;388;385;145,,['N/A'],TRUE,"Schiesser judgment of 4 December 1979, Series A no. 34, p. 17, para. 41;Lawless judgment of 1 July 1961, Series A no. 3, p. 51, para. 12;Neumeister judgment of 27 June 1968, Series A no. 8, pp. 43, 44, para. 23;Guzzardi judgment of 6 November 1980, Series A no. 39, p. 40, para. 108;Deweer judgment of 27 February 1980, Series A no. 35, pp. 24-25, 26, paras. 48, 49;Engel and Others judgment of 8 June 1976, Series A no. 22, pp. 33-36, 37, paras. 80-85, 87;König judgment of 28 June 1978, Series A no. 27, pp. 8, 28, 29-32, 31-32, 32-33, 34, paras. 18, 85, 88-91, 93-95, 96, 98;Ringeisen judgment of 16 July 1971, Series A no. 13, pp. 39, 40, paras. 94, 95, 97;Golder judgment of 21 February 1975, Series A no. 18, pp. 13, 18, paras. 26, 36;De Wilde, Ooms and Versyp judgment of 18 June 1971, Series A no. 12, p. 41, para. 78;Delcourt judgment of 17 January 1970, Series A no. 11, p. 19, para. 35","['LE COMPTE, VAN LEUVEN AND DE MEYERE', 'BELGIUM']",Violation of Art. 6-1;No violation of Art. 11;Just satisfaction reserved,6;6-1;11,"['11', '6', '6-1']"
